,id,parent_id,author,body,score,created_utc,author_flair_text,is_submitter,permalink,_replies,_submission,_reddit,subreddit_id,approved_at_utc,author_is_blocked,comment_type,awarders,mod_reason_by,banned_by,author_flair_type,total_awards_received,subreddit,author_flair_template_id,likes,user_reports,saved,banned_at_utc,mod_reason_title,gilded,archived,collapsed_reason_code,no_follow,can_mod_post,send_replies,author_fullname,approved_by,mod_note,all_awardings,collapsed,edited,top_awarded_type,author_flair_css_class,name,downs,author_flair_richtext,author_patreon_flair,body_html,removal_reason,collapsed_reason,distinguished,associated_award,stickied,author_premium,can_gild,gildings,unrepliable_reason,author_flair_text_color,score_hidden,subreddit_type,locked,report_reasons,created,treatment_tags,link_id,subreddit_name_prefixed,controversiality,depth,author_flair_background_color,collapsed_because_crowd_control,mod_reports,num_reports,ups,_fetched
0,hnu4e98,t3_rcc4u7,SnakeEyeskid,"Delta8 is less dose potent and more body less head high from my experience / research.

Not bad, could be mixed with CBN and 9 for some interesting new highs.",4,1639045026.0,,False,/r/Drugs/comments/rcc4u7/is_there_a_valid_reason_to_smoke_delta_8_when/hnu4e98/,<praw.models.comment_forest.CommentForest object at 0x7fe89cf26760>,rcc4u7,<praw.reddit.Reddit object at 0x7fe89b25e040>,t5_2qh7l,,False,,[],,,text,0,Drugs,,,[],False,,,0,False,,False,False,True,t2_a09n0ikc,,,[],False,False,,,t1_hnu4e98,0,[],False,"<div class=""md""><p>Delta8 is less dose potent and more body less head high from my experience / research.</p>

<p>Not bad, could be mixed with CBN and 9 for some interesting new highs.</p>
</div>",,,,,False,False,True,{},,,False,public,False,,1639045026.0,[],t3_rcc4u7,r/Drugs,0,0,,,[],,4,True
1,hnvpucj,t3_rcc4u7,greysquirrels,The price. Near me d9 is $60 a gram while d8 is $1.50 a gram. I’d rather buy 20 grams for the price of a d9 cart,1,1639073646.0,,False,/r/Drugs/comments/rcc4u7/is_there_a_valid_reason_to_smoke_delta_8_when/hnvpucj/,<praw.models.comment_forest.CommentForest object at 0x7fe89cf268b0>,rcc4u7,<praw.reddit.Reddit object at 0x7fe89b25e040>,t5_2qh7l,,False,,[],,,text,0,Drugs,,,[],False,,,0,False,,False,False,True,t2_yy9mn,,,[],False,False,,,t1_hnvpucj,0,[],False,"<div class=""md""><p>The price. Near me d9 is $60 a gram while d8 is $1.50 a gram. I’d rather buy 20 grams for the price of a d9 cart</p>
</div>",,,,,False,False,True,{},,,False,public,False,,1639073646.0,[],t3_rcc4u7,r/Drugs,0,0,,,[],,1,True
2,hnw7xaz,t3_rcc4u7,bpipeb,"Delta 8 is legal in states where delta 9 is not, if you mean in states where delta 9s allowed then idk.",1,1639080852.0,,False,/r/Drugs/comments/rcc4u7/is_there_a_valid_reason_to_smoke_delta_8_when/hnw7xaz/,<praw.models.comment_forest.CommentForest object at 0x7fe89cf268e0>,rcc4u7,<praw.reddit.Reddit object at 0x7fe89b25e040>,t5_2qh7l,,False,,[],,,text,0,Drugs,,,[],False,,,0,False,,False,False,True,t2_3eo9xbqi,,,[],False,False,,,t1_hnw7xaz,0,[],False,"<div class=""md""><p>Delta 8 is legal in states where delta 9 is not, if you mean in states where delta 9s allowed then idk.</p>
</div>",,,,,False,False,True,{},,,False,public,False,,1639080852.0,[],t3_rcc4u7,r/Drugs,0,0,,,[],,1,True
