,_replies,_submission,_reddit,subreddit_id,approved_at_utc,author_is_blocked,comment_type,awarders,mod_reason_by,banned_by,author_flair_type,total_awards_received,subreddit,author_flair_template_id,likes,user_reports,saved,id,banned_at_utc,mod_reason_title,gilded,archived,collapsed_reason_code,no_follow,author,can_mod_post,created_utc,send_replies,parent_id,score,author_fullname,approved_by,mod_note,all_awardings,collapsed,body,edited,top_awarded_type,author_flair_css_class,name,is_submitter,downs,author_flair_richtext,author_patreon_flair,body_html,removal_reason,collapsed_reason,distinguished,associated_award,stickied,author_premium,can_gild,gildings,unrepliable_reason,author_flair_text_color,score_hidden,permalink,subreddit_type,locked,report_reasons,created,author_flair_text,treatment_tags,link_id,subreddit_name_prefixed,controversiality,depth,author_flair_background_color,collapsed_because_crowd_control,mod_reports,num_reports,ups,_fetched
0,<praw.models.comment_forest.CommentForest object at 0x7fe0a383cc40>,ibphar,<praw.reddit.Reddit object at 0x7fe0a30a7760>,t5_2kpdau,,False,,[],,,text,0,delta8,,,[],False,g1xqd8p,,,0,True,,False,Bvpn,False,1597714861.0,True,t3_ibphar,6,t2_7el3njsh,,,[],False,"Also, this is very very important for *legal* reasons.

If you are buying a product that does not measure a LOQ at or below 0.3% for ∆9 thc, *you are likely buying a product that is not farm bill complaint and may be legally classified as marijuana*. Any, and I mean *any* LOQ above 0.3% for ∆9 thc is unacceptable, and venders who sell products that do not conform to this proper testing are putting *you*, yes *you*, at legal risk of being held criminally liable for interstate commerce of marijuana. 

If you are willing to still buy an improperly tested product despite that, so be it, make your own life decisions. But, if not, please steer clear of venders who do not test properly (the current most popular venders on this sub *do not* test properly fyi).",False,,,t1_g1xqd8p,False,0,[],False,"<div class=""md""><p>Also, this is very very important for <em>legal</em> reasons.</p>

<p>If you are buying a product that does not measure a LOQ at or below 0.3% for ∆9 thc, <em>you are likely buying a product that is not farm bill complaint and may be legally classified as marijuana</em>. Any, and I mean <em>any</em> LOQ above 0.3% for ∆9 thc is unacceptable, and venders who sell products that do not conform to this proper testing are putting <em>you</em>, yes <em>you</em>, at legal risk of being held criminally liable for interstate commerce of marijuana. </p>

<p>If you are willing to still buy an improperly tested product despite that, so be it, make your own life decisions. But, if not, please steer clear of venders who do not test properly (the current most popular venders on this sub <em>do not</em> test properly fyi).</p>
</div>",,,,,False,False,True,{},,,False,/r/delta8/comments/ibphar/vendors_please_check_the_testing_specs_of_a/g1xqd8p/,public,False,,1597714861.0,,[],t3_ibphar,r/delta8,0,0,,,[],,6,True
1,<praw.models.comment_forest.CommentForest object at 0x7fe0a383c2e0>,ibphar,<praw.reddit.Reddit object at 0x7fe0a30a7760>,t5_2kpdau,,False,,[],,,text,0,delta8,,,[],False,g1xqveo,,,0,True,,True,JanElizKor,False,1597715135.0,True,t3_ibphar,0,t2_15qrrx01,,,[],False,🍿 🍿,False,,,t1_g1xqveo,False,0,[],False,"<div class=""md""><p>🍿 🍿</p>
</div>",,,,,False,False,True,{},,,False,/r/delta8/comments/ibphar/vendors_please_check_the_testing_specs_of_a/g1xqveo/,public,False,,1597715135.0,,[],t3_ibphar,r/delta8,1,0,,,[],,0,True
