,_replies,_submission,_reddit,total_awards_received,approved_at_utc,author_is_blocked,comment_type,awarders,mod_reason_by,banned_by,ups,removal_reason,link_id,author_flair_template_id,likes,user_reports,saved,id,banned_at_utc,mod_reason_title,gilded,archived,collapsed_reason_code,no_follow,author,can_mod_post,send_replies,parent_id,score,approved_by,report_reasons,all_awardings,subreddit_id,body,edited,downs,author_flair_css_class,collapsed,is_submitter,body_html,gildings,collapsed_reason,associated_award,stickied,subreddit_type,can_gild,top_awarded_type,unrepliable_reason,author_flair_text_color,score_hidden,permalink,num_reports,locked,name,created,subreddit,author_flair_text,treatment_tags,created_utc,subreddit_name_prefixed,controversiality,depth,author_flair_background_color,collapsed_because_crowd_control,mod_reports,mod_note,distinguished,_fetched
0,<praw.models.comment_forest.CommentForest object at 0x7fe0a383f850>,hlspwu,<praw.reddit.Reddit object at 0x7fe0a30a7760>,0,,False,,[],,,9,,t3_hlspwu,,,[],False,fx13j8c,,,0,True,,False,,False,True,t3_hlspwu,9,,,[],t5_2kpdau,"I know they exist, not sure of any names. 

However, I know vendors have sent samples and have had samples sent where they had to discuss results. From what Ive heard even the DEA labs dont have consistent methodologies either. 

Its really a crap shoot lol.",False,0,,False,False,"<div class=""md""><p>I know they exist, not sure of any names. </p>

<p>However, I know vendors have sent samples and have had samples sent where they had to discuss results. From what Ive heard even the DEA labs dont have consistent methodologies either. </p>

<p>Its really a crap shoot lol.</p>
</div>",{},,,False,public,False,,,dark,False,/r/delta8/comments/hlspwu/dea_certified_laboratory_to_get_testing_done/fx13j8c/,,False,t1_fx13j8c,1593980124.0,delta8,,[],1593980124.0,r/delta8,0,0,,,[],,,True
