,_replies,_submission,_reddit,subreddit_id,approved_at_utc,author_is_blocked,comment_type,awarders,mod_reason_by,banned_by,author_flair_type,total_awards_received,subreddit,author_flair_template_id,likes,user_reports,saved,id,banned_at_utc,mod_reason_title,gilded,archived,collapsed_reason_code,no_follow,author,can_mod_post,created_utc,send_replies,parent_id,score,author_fullname,approved_by,mod_note,all_awardings,collapsed,body,edited,top_awarded_type,author_flair_css_class,name,is_submitter,downs,author_flair_richtext,author_patreon_flair,body_html,removal_reason,collapsed_reason,distinguished,associated_award,stickied,author_premium,can_gild,gildings,unrepliable_reason,author_flair_text_color,score_hidden,permalink,subreddit_type,locked,report_reasons,created,author_flair_text,treatment_tags,link_id,subreddit_name_prefixed,controversiality,depth,author_flair_background_color,collapsed_because_crowd_control,mod_reports,num_reports,ups,_fetched
0,<praw.models.comment_forest.CommentForest object at 0x7fe0a364d5e0>,hzbon4,<praw.reddit.Reddit object at 0x7fe0a30a7760>,t5_2kpdau,,False,,[],,,text,0,delta8,,,[],False,fzi9ems,,,0,True,,False,iamaroundyou,False,1595940042.0,True,t3_hzbon4,4,t2_7a1a5mi5,,,[],False,The amount of d8 in hemp is so minuscule that it shouldn’t cause any problems in pushing towards that 0.3% limit. THCA is the one that will be hardest to get down below 0.3%,False,,,t1_fzi9ems,False,0,[],False,"<div class=""md""><p>The amount of d8 in hemp is so minuscule that it shouldn’t cause any problems in pushing towards that 0.3% limit. THCA is the one that will be hardest to get down below 0.3%</p>
</div>",,,,,False,False,True,{},,,False,/r/delta8/comments/hzbon4/delta_8_thc_total_thc/fzi9ems/,public,False,,1595940042.0,,[],t3_hzbon4,r/delta8,0,0,,,[],,4,True
1,<praw.models.comment_forest.CommentForest object at 0x7fe0a364d8b0>,hzbon4,<praw.reddit.Reddit object at 0x7fe0a30a7760>,t5_2kpdau,,False,,[],,,text,0,delta8,,,[],False,fzhxiuh,,,0,True,,True,TheTetraGuy,False,1595929675.0,True,t3_hzbon4,3,t2_141eoj,,,[],False,"D9 and d8 are reported seperate.
The d8 does not contribute to your 0.3% total thc limit.",False,,,t1_fzhxiuh,False,0,[],False,"<div class=""md""><p>D9 and d8 are reported seperate.
The d8 does not contribute to your 0.3% total thc limit.</p>
</div>",,,,,False,False,True,{},,,False,/r/delta8/comments/hzbon4/delta_8_thc_total_thc/fzhxiuh/,public,False,,1595929675.0,,[],t3_hzbon4,r/delta8,0,0,,,[],,3,True
2,<praw.models.comment_forest.CommentForest object at 0x7fe0a364d2b0>,hzbon4,<praw.reddit.Reddit object at 0x7fe0a30a7760>,t5_2kpdau,,False,,[],,,text,0,delta8,,,[],False,fzkzf5m,,,0,True,,True,CamboMcfly,False,1595990948.0,True,t3_hzbon4,2,t2_lk2vt,,,[],False,Who told you d8 wasn’t psychoactive,False,,,t1_fzkzf5m,False,0,[],False,"<div class=""md""><p>Who told you d8 wasn’t psychoactive</p>
</div>",,,,,False,False,True,{},,,False,/r/delta8/comments/hzbon4/delta_8_thc_total_thc/fzkzf5m/,public,False,,1595990948.0,,[],t3_hzbon4,r/delta8,0,0,,,[],,2,True
