,_replies,_submission,_reddit,subreddit_id,approved_at_utc,author_is_blocked,comment_type,awarders,mod_reason_by,banned_by,author_flair_type,total_awards_received,subreddit,author_flair_template_id,likes,user_reports,saved,id,banned_at_utc,mod_reason_title,gilded,archived,collapsed_reason_code,no_follow,author,can_mod_post,created_utc,send_replies,parent_id,score,author_fullname,approved_by,mod_note,all_awardings,collapsed,body,edited,top_awarded_type,author_flair_css_class,name,is_submitter,downs,author_flair_richtext,author_patreon_flair,body_html,removal_reason,collapsed_reason,distinguished,associated_award,stickied,author_premium,can_gild,gildings,unrepliable_reason,author_flair_text_color,score_hidden,permalink,subreddit_type,locked,report_reasons,created,author_flair_text,treatment_tags,link_id,subreddit_name_prefixed,controversiality,depth,author_flair_background_color,collapsed_because_crowd_control,mod_reports,num_reports,ups,_fetched
0,<praw.models.comment_forest.CommentForest object at 0x7fe0a37199d0>,j8rwsf,<praw.reddit.Reddit object at 0x7fe0a30a7760>,t5_2kpdau,,False,,[],,,text,0,delta8,,,[],False,g8dv5fl,,,0,True,,False,Common-Huckleberry-9,False,1602369547.0,True,t3_j8rwsf,34,t2_7hkqy1dg,,,[],False,Y’all don’t care about kids getting dxm and dph or benzedrex? Cause that’s way worse than them getting d8 just saying,False,,,t1_g8dv5fl,False,0,[],False,"<div class=""md""><p>Y’all don’t care about kids getting dxm and dph or benzedrex? Cause that’s way worse than them getting d8 just saying</p>
</div>",,,,,False,False,True,{},,,False,/r/delta8/comments/j8rwsf/lets_talk_about_d8_legality_folks/g8dv5fl/,public,False,,1602369547.0,,[],t3_j8rwsf,r/delta8,0,0,,,[],,34,True
1,<praw.models.comment_forest.CommentForest object at 0x7fe0a37193d0>,j8rwsf,<praw.reddit.Reddit object at 0x7fe0a30a7760>,t5_2kpdau,,False,,[],,,,0,delta8,,,[],False,g8e6zha,,,0,True,,False,,False,1602373298.0,True,t3_j8rwsf,26,,,,[],False,"The war on drugs created more drug addicts and criminals than decriminalizing would have. 

If you’re not good enough of a parent to talk to your kids about drugs, then maybe don’t have them. The government needs to decriminalize weed and it’s derivatives, not take over as a baby sitter because parents are failing their kids.",False,,,t1_g8e6zha,False,0,,,"<div class=""md""><p>The war on drugs created more drug addicts and criminals than decriminalizing would have. </p>

<p>If you’re not good enough of a parent to talk to your kids about drugs, then maybe don’t have them. The government needs to decriminalize weed and it’s derivatives, not take over as a baby sitter because parents are failing their kids.</p>
</div>",,,,,False,,False,{},,dark,False,/r/delta8/comments/j8rwsf/lets_talk_about_d8_legality_folks/g8e6zha/,public,False,,1602373298.0,,[],t3_j8rwsf,r/delta8,0,0,,,[],,26,True
2,<praw.models.comment_forest.CommentForest object at 0x7fe0a3719d90>,j8rwsf,<praw.reddit.Reddit object at 0x7fe0a30a7760>,t5_2kpdau,,False,,[],,,text,0,delta8,,,[],False,g8dwebk,,,0,True,,False,doyouevensmokebruh,False,1602369936.0,True,t3_j8rwsf,8,t2_7sbu5e9i,,,[],False,"As nice as it would be to have a age restriction, the dea/government wouldnt allow that. The 20th will either make customers criminals, or not effect us at all. If they dont change anything, ultimately it would be up to websites to enforce 21yo requirement. Even then do we really want to trust vendors to handle our info?",False,,,t1_g8dwebk,False,0,[],False,"<div class=""md""><p>As nice as it would be to have a age restriction, the dea/government wouldnt allow that. The 20th will either make customers criminals, or not effect us at all. If they dont change anything, ultimately it would be up to websites to enforce 21yo requirement. Even then do we really want to trust vendors to handle our info?</p>
</div>",,,,,False,False,True,{},,,False,/r/delta8/comments/j8rwsf/lets_talk_about_d8_legality_folks/g8dwebk/,public,False,,1602369936.0,,[],t3_j8rwsf,r/delta8,0,0,,,[],,8,True
3,<praw.models.comment_forest.CommentForest object at 0x7fe0a3719f10>,j8rwsf,<praw.reddit.Reddit object at 0x7fe0a30a7760>,t5_2kpdau,,False,,[],,,text,0,delta8,,,[],False,g8df6xh,,,0,True,,False,Tingsilike,False,1602364464.0,True,t3_j8rwsf,7,t2_hhwlrcf,,,[],False,"Wow, such a serious post.. It's pretty simple really either they leave it be or they criminalize. I doubt they will set limits on it, all though that would be the most ideal as children should not have direct access to it in my opinion.",False,,,t1_g8df6xh,False,0,[],False,"<div class=""md""><p>Wow, such a serious post.. It&#39;s pretty simple really either they leave it be or they criminalize. I doubt they will set limits on it, all though that would be the most ideal as children should not have direct access to it in my opinion.</p>
</div>",,,,,False,False,True,{},,,False,/r/delta8/comments/j8rwsf/lets_talk_about_d8_legality_folks/g8df6xh/,public,False,,1602364464.0,,[],t3_j8rwsf,r/delta8,0,0,,,[],,7,True
4,<praw.models.comment_forest.CommentForest object at 0x7fe0a37192e0>,j8rwsf,<praw.reddit.Reddit object at 0x7fe0a30a7760>,t5_2kpdau,,False,,[],,,text,0,delta8,,,[],False,g8eesvw,,,0,True,,False,k4zoo,False,1602375827.0,True,t3_j8rwsf,6,t2_c34qz,,,[],False,"Whatever policies are in place for nicotine e-juice purchases over the internet, just put those in place. Those policies appear to be a secure way of only allowing adults to purchase from their websites.",False,,,t1_g8eesvw,False,0,[],False,"<div class=""md""><p>Whatever policies are in place for nicotine e-juice purchases over the internet, just put those in place. Those policies appear to be a secure way of only allowing adults to purchase from their websites.</p>
</div>",,,,,False,False,True,{},,,False,/r/delta8/comments/j8rwsf/lets_talk_about_d8_legality_folks/g8eesvw/,public,False,,1602375827.0,,[],t3_j8rwsf,r/delta8,0,0,,,[],,6,True
5,<praw.models.comment_forest.CommentForest object at 0x7fe0a3719220>,j8rwsf,<praw.reddit.Reddit object at 0x7fe0a30a7760>,t5_2kpdau,,False,,[],,,text,0,delta8,,,[],False,g8hn52b,,,0,True,,True,ACAB1983,False,1602426302.0,True,t3_j8rwsf,2,t2_79sgwyxx,,,[],False,"The DEA and Govt. know all about phenibut, etizolam, clonazolam, and many other dangerous addictive research chemicals and they don’t regulate or ban them. Why are they going after Delta-8 and hemp related products when these drugs are easily available?",False,,,t1_g8hn52b,False,0,[],False,"<div class=""md""><p>The DEA and Govt. know all about phenibut, etizolam, clonazolam, and many other dangerous addictive research chemicals and they don’t regulate or ban them. Why are they going after Delta-8 and hemp related products when these drugs are easily available?</p>
</div>",,,,,False,False,True,{},,,False,/r/delta8/comments/j8rwsf/lets_talk_about_d8_legality_folks/g8hn52b/,public,False,,1602426302.0,,[],t3_j8rwsf,r/delta8,0,0,,,[],,2,True
6,<praw.models.comment_forest.CommentForest object at 0x7fe0a37192b0>,j8rwsf,<praw.reddit.Reddit object at 0x7fe0a30a7760>,t5_2kpdau,,False,,[],,,text,0,delta8,,,[],False,g8gakss,,,0,True,,True,discgolf9000,False,1602402508.0,True,t3_j8rwsf,1,t2_7cm2esvt,,,[],False,How about a company that does their due diligence and uses a courier that is reliable and requires an adult signature??? It can’t be that hard,False,,,t1_g8gakss,False,0,[],False,"<div class=""md""><p>How about a company that does their due diligence and uses a courier that is reliable and requires an adult signature??? It can’t be that hard</p>
</div>",,,,,False,False,True,{},,,False,/r/delta8/comments/j8rwsf/lets_talk_about_d8_legality_folks/g8gakss/,public,False,,1602402508.0,,[],t3_j8rwsf,r/delta8,0,0,,,[],,1,True
7,<praw.models.comment_forest.CommentForest object at 0x7fe0a3719670>,j8rwsf,<praw.reddit.Reddit object at 0x7fe0a30a7760>,t5_2kpdau,,False,,[],,,text,0,delta8,,,[],False,g8et208,,,0,True,LOW_SCORE,True,SirShankAllot,False,1602380561.0,True,t3_j8rwsf,-5,t2_1fbx8b19,,,[],True,"Kratom is not an opiate.  It does give similar effects to opiates but it is NOT an opiate.  If it was, the DEA wouldn't need/want to schedule it as it would already be scheduled.  Kinda disappointing you don't know that especially considering you're familiar with it.",False,,,t1_g8et208,False,0,[],False,"<div class=""md""><p>Kratom is not an opiate.  It does give similar effects to opiates but it is NOT an opiate.  If it was, the DEA wouldn&#39;t need/want to schedule it as it would already be scheduled.  Kinda disappointing you don&#39;t know that especially considering you&#39;re familiar with it.</p>
</div>",,comment score below threshold,,,False,False,True,{},,,False,/r/delta8/comments/j8rwsf/lets_talk_about_d8_legality_folks/g8et208/,public,False,,1602380561.0,,[],t3_j8rwsf,r/delta8,0,0,,,[],,-5,True
8,<praw.models.comment_forest.CommentForest object at 0x7fe0a3719bb0>,j8rwsf,<praw.reddit.Reddit object at 0x7fe0a30a7760>,t5_2kpdau,,False,,[],,,text,0,delta8,,,[],False,g8do86k,,,0,True,LOW_SCORE,True,randy195306,False,1602367357.0,True,t3_j8rwsf,-9,t2_5cskplqf,,,[],True,"I think they do need to put limits on it.
At least make copy of your driver's license to send in if you buy online.
Sure it's not failsafe but makes the kid at least to take his parents driver license .
Simple things like this are easily done. It doesn't need to be a law companies like 3chi, snapdragon can pave the way and just make it company policy imo",False,,,t1_g8do86k,False,0,[],False,"<div class=""md""><p>I think they do need to put limits on it.
At least make copy of your driver&#39;s license to send in if you buy online.
Sure it&#39;s not failsafe but makes the kid at least to take his parents driver license .
Simple things like this are easily done. It doesn&#39;t need to be a law companies like 3chi, snapdragon can pave the way and just make it company policy imo</p>
</div>",,comment score below threshold,,,False,False,True,{},,,False,/r/delta8/comments/j8rwsf/lets_talk_about_d8_legality_folks/g8do86k/,public,False,,1602367357.0,,[],t3_j8rwsf,r/delta8,0,0,,,[],,-9,True
