Unnamed: 0,_replies,_submission,_reddit,author_flair_text,subreddit_id,approved_at_utc,author_is_blocked,comment_type,awarders,mod_reason_by,banned_by,author_flair_type,total_awards_received,subreddit,author_flair_template_id,likes,user_reports,saved,id,banned_at_utc,mod_reason_title,gilded,archived,collapsed_reason_code,no_follow,author,can_mod_post,created_utc,send_replies,parent_id,score,author_fullname,approved_by,mod_note,all_awardings,collapsed,body,edited,top_awarded_type,author_flair_css_class,name,is_submitter,downs,author_flair_richtext,author_patreon_flair,body_html,removal_reason,collapsed_reason,distinguished,associated_award,stickied,author_premium,can_gild,gildings,unrepliable_reason,author_flair_text_color,score_hidden,permalink,subreddit_type,locked,report_reasons,created,treatment_tags,link_id,subreddit_name_prefixed,controversiality,depth,author_flair_background_color,collapsed_because_crowd_control,mod_reports,num_reports,ups,_fetched
0,<praw.models.comment_forest.CommentForest object at 0x7fe0a3590760>,hxgav0,<praw.reddit.Reddit object at 0x7fe0a30a7760>,,t5_2kpdau,,False,,[],,,text,0,delta8,,,[],False,fz5zdsu,,,0,True,,False,burntrats,False,1595650203.0,True,t3_hxgav0,7,t2_74bzjvnt,,,[],False,"Sounds about right for most companies at this point and time.
 It's still going to be awhile before all doubts are eliminated when dealing with the majority of folks pushing 8. It's only going to get worse as more and more try to turn a buck.",False,,,t1_fz5zdsu,False,0,[],False,"<div class=""md""><p>Sounds about right for most companies at this point and time.
 It&#39;s still going to be awhile before all doubts are eliminated when dealing with the majority of folks pushing 8. It&#39;s only going to get worse as more and more try to turn a buck.</p>
</div>",,,,,False,False,True,{},,,False,/r/delta8/comments/hxgav0/criticism_of_blackwater_hemp_cartridges/fz5zdsu/,public,False,,1595650203.0,[],t3_hxgav0,r/delta8,0,0,,,[],,7,True
1,<praw.models.comment_forest.CommentForest object at 0x7fe0a3590e50>,hxgav0,<praw.reddit.Reddit object at 0x7fe0a30a7760>,,t5_2kpdau,,False,,[],,,text,0,delta8,,,[],False,fz81hgl,,,0,True,,True,oogaboogaloo123,False,1595704790.0,True,t3_hxgav0,1,t2_4yl2aspz,,,[],False,was it shipped discretely?,False,,,t1_fz81hgl,False,0,[],False,"<div class=""md""><p>was it shipped discretely?</p>
</div>",,,,,False,False,True,{},,,False,/r/delta8/comments/hxgav0/criticism_of_blackwater_hemp_cartridges/fz81hgl/,public,False,,1595704790.0,[],t3_hxgav0,r/delta8,0,0,,,[],,1,True
2,<praw.models.comment_forest.CommentForest object at 0x7fe0a35906d0>,hxgav0,<praw.reddit.Reddit object at 0x7fe0a30a7760>,,t5_2kpdau,,False,,[],,,text,0,delta8,,,[],False,g20qurb,,,0,True,,True,weedabo,False,1597778305.0,True,t3_hxgav0,1,t2_3hrd20v7,,,[],False,Dude this lab result is the same one on bulk disty website.  Idk if they supply black water but I’m going thru the different labs on bulk disty and all but 1 have the name Stewart Andy on them and the same address in Oklahoma.  Idk who’s using who’s labs but I will say my order from bulk disty came from OK too so idk.,False,,,t1_g20qurb,False,0,[],False,"<div class=""md""><p>Dude this lab result is the same one on bulk disty website.  Idk if they supply black water but I’m going thru the different labs on bulk disty and all but 1 have the name Stewart Andy on them and the same address in Oklahoma.  Idk who’s using who’s labs but I will say my order from bulk disty came from OK too so idk.</p>
</div>",,,,,False,False,True,{},,,False,/r/delta8/comments/hxgav0/criticism_of_blackwater_hemp_cartridges/g20qurb/,public,False,,1597778305.0,[],t3_hxgav0,r/delta8,0,0,,,[],,1,True
