,_replies,_submission,_reddit,subreddit_id,approved_at_utc,author_is_blocked,comment_type,awarders,mod_reason_by,banned_by,author_flair_type,total_awards_received,subreddit,author_flair_template_id,likes,user_reports,saved,id,banned_at_utc,mod_reason_title,gilded,archived,collapsed_reason_code,no_follow,author,can_mod_post,created_utc,send_replies,parent_id,score,author_fullname,approved_by,mod_note,all_awardings,collapsed,body,edited,top_awarded_type,author_flair_css_class,name,is_submitter,downs,author_flair_richtext,author_patreon_flair,body_html,removal_reason,collapsed_reason,distinguished,associated_award,stickied,author_premium,can_gild,gildings,unrepliable_reason,author_flair_text_color,score_hidden,permalink,subreddit_type,locked,report_reasons,created,author_flair_text,treatment_tags,link_id,subreddit_name_prefixed,controversiality,depth,author_flair_background_color,collapsed_because_crowd_control,mod_reports,num_reports,ups,_fetched
0,<praw.models.comment_forest.CommentForest object at 0x7fe09f25c7c0>,qhr7it,<praw.reddit.Reddit object at 0x7fe0a30a7760>,t5_2zu88u,,False,,[],,,text,0,delta8testing,,,[],False,hiinqfh,,,0,False,,True,StoneyMcTerpface,False,1635518505.0,True,t3_qhr7it,3,t2_5m55yuj,,,[],False,"Thanks for posting. I would like to see a column that shows the laboratory that was used by the manufacturer. A quick review of the COA's for concentrates and vapes shows that the popular labs are: Altitude Consulting, ACS, Marin, and SD PharmLabs. I wonder why these labs are used more often than other laboratories?",False,,,t1_hiinqfh,False,0,[],False,"<div class=""md""><p>Thanks for posting. I would like to see a column that shows the laboratory that was used by the manufacturer. A quick review of the COA&#39;s for concentrates and vapes shows that the popular labs are: Altitude Consulting, ACS, Marin, and SD PharmLabs. I wonder why these labs are used more often than other laboratories?</p>
</div>",,,,,False,False,True,{},,dark,False,/r/delta8testing/comments/qhr7it/full_spreadsheet_of_cbd_oracle_test_results/hiinqfh/,public,False,,1635518505.0,quality posts,[],t3_qhr7it,r/delta8testing,0,0,,,[],,3,True
1,<praw.models.comment_forest.CommentForest object at 0x7fe09f25c850>,qhr7it,<praw.reddit.Reddit object at 0x7fe0a30a7760>,t5_2zu88u,,False,,[],,,text,0,delta8testing,,,[],False,hiuhbcq,,,0,False,,True,EnochScribe,False,1635738173.0,True,t3_qhr7it,1,t2_njgxv,,,[],False,What's with the edibles at the bottom that test <1% thc? Did some poor fellas really just buy expensive candy?,False,,,t1_hiuhbcq,False,0,[],False,"<div class=""md""><p>What&#39;s with the edibles at the bottom that test &lt;1% thc? Did some poor fellas really just buy expensive candy?</p>
</div>",,,,,False,False,True,{},,,False,/r/delta8testing/comments/qhr7it/full_spreadsheet_of_cbd_oracle_test_results/hiuhbcq/,public,False,,1635738173.0,,[],t3_qhr7it,r/delta8testing,0,0,,,[],,1,True
2,<praw.models.comment_forest.CommentForest object at 0x7fe09f25cb50>,qhr7it,<praw.reddit.Reddit object at 0x7fe0a30a7760>,t5_2zu88u,,False,,[],,,text,0,delta8testing,,,[],False,hj6trcg,,,0,False,,True,BLAHGBLA,False,1635968307.0,True,t3_qhr7it,1,t2_18etng,,,[],False,"From 3Chi saying the tests basically are incompetent. Opinions?  

  
Sorry, but it doesn't. If you're referring to the recent tests from FESA, those incorporate a compound called 4,8 iso THC into their results, and possibly other isomers. But what our oil does have is more D8 than anything else out there.  
Also, those FESA tests were on our clear oil. The new amber/gold oil has more D8, fewer non-D8 compounds, and consistently tests ND-0.2% D9THC when using proper testing methods.",False,,,t1_hj6trcg,False,0,[],False,"<div class=""md""><p>From 3Chi saying the tests basically are incompetent. Opinions?  </p>

<p>Sorry, but it doesn&#39;t. If you&#39;re referring to the recent tests from FESA, those incorporate a compound called 4,8 iso THC into their results, and possibly other isomers. But what our oil does have is more D8 than anything else out there.<br/>
Also, those FESA tests were on our clear oil. The new amber/gold oil has more D8, fewer non-D8 compounds, and consistently tests ND-0.2% D9THC when using proper testing methods.</p>
</div>",,,,,False,False,True,{},,,False,/r/delta8testing/comments/qhr7it/full_spreadsheet_of_cbd_oracle_test_results/hj6trcg/,public,False,,1635968307.0,,[],t3_qhr7it,r/delta8testing,0,0,,,[],,1,True
