Unnamed: 0,_replies,_submission,_reddit,author_flair_text,subreddit_id,approved_at_utc,author_is_blocked,comment_type,awarders,mod_reason_by,banned_by,author_flair_type,total_awards_received,subreddit,author_flair_template_id,likes,user_reports,saved,id,banned_at_utc,mod_reason_title,gilded,archived,collapsed_reason_code,no_follow,author,can_mod_post,created_utc,send_replies,parent_id,score,author_fullname,approved_by,mod_note,all_awardings,collapsed,body,edited,top_awarded_type,author_flair_css_class,name,is_submitter,downs,author_flair_richtext,author_patreon_flair,body_html,removal_reason,collapsed_reason,distinguished,associated_award,stickied,author_premium,can_gild,gildings,unrepliable_reason,author_flair_text_color,score_hidden,permalink,subreddit_type,locked,report_reasons,created,treatment_tags,link_id,subreddit_name_prefixed,controversiality,depth,author_flair_background_color,collapsed_because_crowd_control,mod_reports,num_reports,ups,_fetched
0,<praw.models.comment_forest.CommentForest object at 0x000001BBD4A36EB0>,gxtj6f,<praw.reddit.Reddit object at 0x000001BBD5045D60>,,t5_2kpdau,,False,,[],,,text,0,delta8,,,[],False,ft51mci,,,0,True,,False,mikebe1,False,1591459346.0,True,t3_gxtj6f,4,t2_78onz,,,[],False,"Yup, edible in however way you see fit. Might help to consume something fatty along-side it, but I’ve have success just putting some d8 distillate on my gumline.

Edit: also, as I just made this mistake yesterday - be careful with dissolving the distillate in something too hot, you can kill the potency this way. Speaking by experience, not expertise.",1591459717.0,,,t1_ft51mci,False,0,[],False,"<div class=""md""><p>Yup, edible in however way you see fit. Might help to consume something fatty along-side it, but I’ve have success just putting some d8 distillate on my gumline.</p>

<p>Edit: also, as I just made this mistake yesterday - be careful with dissolving the distillate in something too hot, you can kill the potency this way. Speaking by experience, not expertise.</p>
</div>",,,,,False,False,True,{},,,False,/r/delta8/comments/gxtj6f/a_question_about_the_cbd_haven_distillate_jars/ft51mci/,public,False,,1591459346.0,[],t3_gxtj6f,r/delta8,0,0,,,[],,4,True
1,<praw.models.comment_forest.CommentForest object at 0x000001BBD4A366A0>,gxtj6f,<praw.reddit.Reddit object at 0x000001BBD5045D60>,,t5_2kpdau,,False,,[],,,text,0,delta8,,,[],False,ft55xu2,,,0,True,,False,bugabo21,False,1591460831.0,True,t3_gxtj6f,3,t2_5sfhkuqo,,,[],False,Keep the temps under 150f if cooking with it,False,,,t1_ft55xu2,False,0,[],False,"<div class=""md""><p>Keep the temps under 150f if cooking with it</p>
</div>",,,,,False,False,True,{},,,False,/r/delta8/comments/gxtj6f/a_question_about_the_cbd_haven_distillate_jars/ft55xu2/,public,False,,1591460831.0,[],t3_gxtj6f,r/delta8,0,0,,,[],,3,True
