Unnamed: 0,_replies,_submission,_reddit,author_flair_text,subreddit_id,approved_at_utc,author_is_blocked,comment_type,awarders,mod_reason_by,banned_by,author_flair_type,total_awards_received,subreddit,author_flair_template_id,likes,user_reports,saved,id,banned_at_utc,mod_reason_title,gilded,archived,collapsed_reason_code,no_follow,author,can_mod_post,created_utc,send_replies,parent_id,score,author_fullname,approved_by,mod_note,all_awardings,collapsed,body,edited,top_awarded_type,author_flair_css_class,name,is_submitter,downs,author_flair_richtext,author_patreon_flair,body_html,removal_reason,collapsed_reason,distinguished,associated_award,stickied,author_premium,can_gild,gildings,unrepliable_reason,author_flair_text_color,score_hidden,permalink,subreddit_type,locked,report_reasons,created,treatment_tags,link_id,subreddit_name_prefixed,controversiality,depth,author_flair_background_color,collapsed_because_crowd_control,mod_reports,num_reports,ups,_fetched
0,<praw.models.comment_forest.CommentForest object at 0x000001BBD51815B0>,jrouzz,<praw.reddit.Reddit object at 0x000001BBD5045D60>,,t5_2kpdau,,False,,[],,,text,0,delta8,,,[],False,gbueyk7,,,0,True,,True,AutoModerator,False,1605028157.0,False,t3_jrouzz,1,t2_6l4z3,,,[],False,"Hey, the Δ⁸ friendly automod here.  Looks like you submitted a question post.  Please [read the FAQ](https://www.reddit.com/r/delta8/comments/g6z06o/delta8_faq_start_here/) as many common questions are already answered.  Please also use the search function to see if you question was already answered.

If your question was not covered in the FAQ we appreciate the submission.  If you think the question should be added to our FAQ please send a modmail.

*I am a bot, and this action was performed automatically. Please [contact the moderators of this subreddit](/message/compose/?to=/r/delta8) if you have any questions or concerns.*",False,,,t1_gbueyk7,False,0,[],False,"<div class=""md""><p>Hey, the Δ⁸ friendly automod here.  Looks like you submitted a question post.  Please <a href=""https://www.reddit.com/r/delta8/comments/g6z06o/delta8_faq_start_here/"">read the FAQ</a> as many common questions are already answered.  Please also use the search function to see if you question was already answered.</p>

<p>If your question was not covered in the FAQ we appreciate the submission.  If you think the question should be added to our FAQ please send a modmail.</p>

<p><em>I am a bot, and this action was performed automatically. Please <a href=""/message/compose/?to=/r/delta8"">contact the moderators of this subreddit</a> if you have any questions or concerns.</em></p>
</div>",,,moderator,,True,True,True,{},,,True,/r/delta8/comments/jrouzz/are_delta8_carts_pure_d8_oil_or_do_they_mix_other/gbueyk7/,public,False,,1605028157.0,[],t3_jrouzz,r/delta8,0,0,,,[],,1,True
1,<praw.models.comment_forest.CommentForest object at 0x000001BBD5181760>,jrouzz,<praw.reddit.Reddit object at 0x000001BBD5045D60>,,t5_2kpdau,,False,,[],,,text,0,delta8,,,[],False,gbulc30,,,0,True,,False,NopeNopeNope2020,False,1605031096.0,True,t3_jrouzz,5,t2_4focwzid,,,[],False,"Small hits, bro, small hits, and the cough doesn't happen. Don't obsess over getting big thick clouds, that's where the problem lies.  THree small hits = 1 giant hit, but without the lung issues, at least cough-wise. Take care.",False,,,t1_gbulc30,False,0,[],False,"<div class=""md""><p>Small hits, bro, small hits, and the cough doesn&#39;t happen. Don&#39;t obsess over getting big thick clouds, that&#39;s where the problem lies.  THree small hits = 1 giant hit, but without the lung issues, at least cough-wise. Take care.</p>
</div>",,,,,False,False,True,{},,,False,/r/delta8/comments/jrouzz/are_delta8_carts_pure_d8_oil_or_do_they_mix_other/gbulc30/,public,False,,1605031096.0,[],t3_jrouzz,r/delta8,0,0,,,[],,5,True
2,<praw.models.comment_forest.CommentForest object at 0x000001BBD51817F0>,jrouzz,<praw.reddit.Reddit object at 0x000001BBD5045D60>,,t5_2kpdau,,False,,[],,,text,0,delta8,,,[],False,gbuhbfc,,,0,True,,True,Shadow_Guy01,False,1605029247.0,True,t3_jrouzz,3,t2_vt3nu,,,[],False,"General consensus is that its the terpenes, as straight D8 doesnt make many people cough.

Cannabis derived terps (CDTs) help as well.",False,,,t1_gbuhbfc,False,0,[],False,"<div class=""md""><p>General consensus is that its the terpenes, as straight D8 doesnt make many people cough.</p>

<p>Cannabis derived terps (CDTs) help as well.</p>
</div>",,,,,False,False,True,{},,,False,/r/delta8/comments/jrouzz/are_delta8_carts_pure_d8_oil_or_do_they_mix_other/gbuhbfc/,public,False,,1605029247.0,[],t3_jrouzz,r/delta8,0,0,,,[],,3,True
3,<praw.models.comment_forest.CommentForest object at 0x000001BBD5181970>,jrouzz,<praw.reddit.Reddit object at 0x000001BBD5045D60>,,t5_2kpdau,,False,,[],,,text,0,delta8,,,[],False,gbwi07i,,,0,True,,True,GoochTainter,False,1605066558.0,True,t3_jrouzz,3,t2_68w1vvdg,,,[],False,"Idk what everyone’s talking about cause theyre wrong. D8 hurts like a bitch cause its concentrate and cannabinoids are always harsh. If u ever smoked the d9 carts youll know that they rip just as badly. 

Basically my answer to this is smoke more. You get used to it and cough less its just all about exposure and tolerance. Or else just take multiple little puffs or hell eat the shit lol.",False,,,t1_gbwi07i,False,0,[],False,"<div class=""md""><p>Idk what everyone’s talking about cause theyre wrong. D8 hurts like a bitch cause its concentrate and cannabinoids are always harsh. If u ever smoked the d9 carts youll know that they rip just as badly. </p>

<p>Basically my answer to this is smoke more. You get used to it and cough less its just all about exposure and tolerance. Or else just take multiple little puffs or hell eat the shit lol.</p>
</div>",,,,,False,True,True,{},,,False,/r/delta8/comments/jrouzz/are_delta8_carts_pure_d8_oil_or_do_they_mix_other/gbwi07i/,public,False,,1605066558.0,[],t3_jrouzz,r/delta8,0,0,,,[],,3,True
4,<praw.models.comment_forest.CommentForest object at 0x000001BBD5181A30>,jrouzz,<praw.reddit.Reddit object at 0x000001BBD5045D60>,,t5_2kpdau,,False,,[],,,text,0,delta8,,,[],False,gbwieyo,,,0,True,,True,PureCitrus007,False,1605066811.0,True,t3_jrouzz,2,t2_2tlj10qz,,,[],False,"Besides terps (and I totally agree that BDT's are very often harsher than CDT's), consider your temperature.

Keep The Voltage Low!

Consider trying a small hit on that same cartridge at 2.3 - 2.6 volts. If your vape doesn't adjust that low, you may want to get one that does...one that's made for CBD. 

Between using only carts with CDT's and significantly lowering my voltage (and thus temperature), I'm enjoying my hits so much more now. At the lowest voltages I can do small BDT hits, but I still really prefer those CDT's.",False,,,t1_gbwieyo,False,0,[],False,"<div class=""md""><p>Besides terps (and I totally agree that BDT&#39;s are very often harsher than CDT&#39;s), consider your temperature.</p>

<p>Keep The Voltage Low!</p>

<p>Consider trying a small hit on that same cartridge at 2.3 - 2.6 volts. If your vape doesn&#39;t adjust that low, you may want to get one that does...one that&#39;s made for CBD. </p>

<p>Between using only carts with CDT&#39;s and significantly lowering my voltage (and thus temperature), I&#39;m enjoying my hits so much more now. At the lowest voltages I can do small BDT hits, but I still really prefer those CDT&#39;s.</p>
</div>",,,,,False,False,True,{},,,False,/r/delta8/comments/jrouzz/are_delta8_carts_pure_d8_oil_or_do_they_mix_other/gbwieyo/,public,False,,1605066811.0,[],t3_jrouzz,r/delta8,0,0,,,[],,2,True
5,<praw.models.comment_forest.CommentForest object at 0x000001BBD5181BB0>,jrouzz,<praw.reddit.Reddit object at 0x000001BBD5045D60>,,t5_2kpdau,,False,,[],,,text,0,delta8,,,[],False,gbuk7wo,,,0,True,,True,jglobinhood,False,1605030584.0,True,t3_jrouzz,2,t2_2j91nj2s,,,[],False,"Inhaling vapor that’s 500 degrees F+ tends to irritate most people’s throat. Doesn’t matter what you’re inhaling if it’s that hot. But I typically find terps are more hash than D8 from personal experience. And I almost definitively have more experience than most. Source: 10+ years of smoking flowers, 7+ years of dabbing, and I’ve been working with a lot of D8 over the last year. Most vendors will mix D8 with terps to give it flavor, and sometimes they’ll add other cannabinoids for balanced effects.",False,,,t1_gbuk7wo,False,0,[],False,"<div class=""md""><p>Inhaling vapor that’s 500 degrees F+ tends to irritate most people’s throat. Doesn’t matter what you’re inhaling if it’s that hot. But I typically find terps are more hash than D8 from personal experience. And I almost definitively have more experience than most. Source: 10+ years of smoking flowers, 7+ years of dabbing, and I’ve been working with a lot of D8 over the last year. Most vendors will mix D8 with terps to give it flavor, and sometimes they’ll add other cannabinoids for balanced effects.</p>
</div>",,,,,False,False,True,{},,,False,/r/delta8/comments/jrouzz/are_delta8_carts_pure_d8_oil_or_do_they_mix_other/gbuk7wo/,public,False,,1605030584.0,[],t3_jrouzz,r/delta8,0,0,,,[],,2,True
6,<praw.models.comment_forest.CommentForest object at 0x000001BBD5181D90>,jrouzz,<praw.reddit.Reddit object at 0x000001BBD5045D60>,,t5_2kpdau,,False,,[],,,text,0,delta8,,,[],False,gbuip28,,,0,True,,True,nmanhgn,False,1605029884.0,True,t3_jrouzz,1,t2_2d2xggn3,,,[],False,Dabbing hurts more compared to smoking weed in general that's why the dab dance is a thing because it makes you cough,False,,,t1_gbuip28,False,0,[],False,"<div class=""md""><p>Dabbing hurts more compared to smoking weed in general that&#39;s why the dab dance is a thing because it makes you cough</p>
</div>",,,,,False,False,True,{},,,False,/r/delta8/comments/jrouzz/are_delta8_carts_pure_d8_oil_or_do_they_mix_other/gbuip28/,public,False,,1605029884.0,[],t3_jrouzz,r/delta8,0,0,,,[],,1,True
7,<praw.models.comment_forest.CommentForest object at 0x000001BBD5181E50>,jrouzz,<praw.reddit.Reddit object at 0x000001BBD5045D60>,,t5_2kpdau,,False,,[],,,text,0,delta8,,,[],False,gbv1nqd,,,0,True,,True,jbird12356,False,1605038721.0,True,t3_jrouzz,1,t2_2jdastxn,,,[],False,You are just a pussy,False,,,t1_gbv1nqd,False,0,[],False,"<div class=""md""><p>You are just a pussy</p>
</div>",,,,,False,False,True,{},,,False,/r/delta8/comments/jrouzz/are_delta8_carts_pure_d8_oil_or_do_they_mix_other/gbv1nqd/,public,False,,1605038721.0,[],t3_jrouzz,r/delta8,0,0,,,[],,1,True
