,comment_limit,comment_sort,_reddit,approved_at_utc,subreddit,selftext,author_fullname,saved,mod_reason_title,gilded,clicked,title,link_flair_richtext,subreddit_name_prefixed,hidden,pwls,link_flair_css_class,downs,thumbnail_height,top_awarded_type,hide_score,name,quarantine,link_flair_text_color,upvote_ratio,author_flair_background_color,ups,total_awards_received,media_embed,thumbnail_width,author_flair_template_id,is_original_content,user_reports,secure_media,is_reddit_media_domain,is_meta,category,secure_media_embed,link_flair_text,can_mod_post,score,approved_by,is_created_from_ads_ui,author_premium,thumbnail,edited,author_flair_css_class,author_flair_richtext,gildings,post_hint,content_categories,is_self,subreddit_type,created,link_flair_type,wls,removed_by_category,banned_by,author_flair_type,domain,allow_live_comments,selftext_html,likes,suggested_sort,banned_at_utc,url_overridden_by_dest,view_count,archived,no_follow,is_crosspostable,pinned,over_18,preview,all_awardings,awarders,media_only,link_flair_template_id,can_gild,spoiler,locked,author_flair_text,treatment_tags,visited,removed_by,mod_note,distinguished,subreddit_id,author_is_blocked,mod_reason_by,num_reports,removal_reason,link_flair_background_color,id,is_robot_indexable,report_reasons,author,discussion_type,num_comments,send_replies,whitelist_status,contest_mode,mod_reports,author_patreon_flair,author_flair_text_color,permalink,parent_whitelist_status,stickied,url,subreddit_subscribers,created_utc,num_crossposts,media,is_video,_fetched,_comments_by_id,poll_data,crosspost_parent_list,crosspost_parent
0,2048,confidence,<praw.reddit.Reddit object at 0x7fbefadafc40>,,texas,,t2_fbmpz1xa,False,,0,False,Texas Supreme Court Denies DSHS request to Ban Delta 8 THC,"[{'e': 'text', 't': 'News'}]",r/texas,False,6,,0,105.0,,False,t3_rzfv4o,False,light,0.98,,495,0,{},140.0,,False,[],,False,False,,{},News,False,495,,False,False,https://a.thumbs.redditmedia.com/ZEH2vP91KE7PJQ5ljMUSc19sCmPgG9rzuntcKKs-Ah4.jpg,False,,[],{},link,,False,public,1641691691.0,richtext,6,,,text,fwweekly.com,False,,,confidence,,https://www.fwweekly.com/2022/01/07/texas-supreme-court-denies-dshs-request-to-ban-delta-8-thc/,,False,False,False,False,False,"{'images': [{'source': {'url': 'https://external-preview.redd.it/RvVooI91P5g8a4LRuQ4DNleYolzyUYUff9Of0WKVTeg.jpg?auto=webp&s=36ee6682d108534d0e5a38e444b45acf730dc33c', 'width': 1100, 'height': 825}, 'resolutions': [{'url': 'https://external-preview.redd.it/RvVooI91P5g8a4LRuQ4DNleYolzyUYUff9Of0WKVTeg.jpg?width=108&crop=smart&auto=webp&s=c3d55f1eb31bab0bea0044e010c6eac10aff860a', 'width': 108, 'height': 81}, {'url': 'https://external-preview.redd.it/RvVooI91P5g8a4LRuQ4DNleYolzyUYUff9Of0WKVTeg.jpg?width=216&crop=smart&auto=webp&s=09da7f8836addc3b0764e273aa1ef9554fa5b769', 'width': 216, 'height': 162}, {'url': 'https://external-preview.redd.it/RvVooI91P5g8a4LRuQ4DNleYolzyUYUff9Of0WKVTeg.jpg?width=320&crop=smart&auto=webp&s=06d88a71310ba3a327d497f33e7f703047d63322', 'width': 320, 'height': 240}, {'url': 'https://external-preview.redd.it/RvVooI91P5g8a4LRuQ4DNleYolzyUYUff9Of0WKVTeg.jpg?width=640&crop=smart&auto=webp&s=74f8d44c008995fcf5027c781c277ff79c617ebc', 'width': 640, 'height': 480}, {'url': 'https://external-preview.redd.it/RvVooI91P5g8a4LRuQ4DNleYolzyUYUff9Of0WKVTeg.jpg?width=960&crop=smart&auto=webp&s=1afca78b5db05d83c0228cdc6e2587f21c22b2a8', 'width': 960, 'height': 720}, {'url': 'https://external-preview.redd.it/RvVooI91P5g8a4LRuQ4DNleYolzyUYUff9Of0WKVTeg.jpg?width=1080&crop=smart&auto=webp&s=6de72fe2ab42fed912c0eb0360d49bb559b030b4', 'width': 1080, 'height': 810}], 'variants': {}, 'id': 'sQkNUZcLYhvt22RZEkL5OHWDi2n9UGqL_Iw832FEbe8'}], 'enabled': False}",[],[],False,dd1d9f22-d066-11e7-a592-0e9f2c9b3e5c,False,False,False,,[],False,,,,t5_2qho4,False,,,,#373c3f,rzfv4o,True,,MostlyIndustrious,,134,True,all_ads,False,[],False,,/r/texas/comments/rzfv4o/texas_supreme_court_denies_dshs_request_to_ban/,all_ads,False,https://www.fwweekly.com/2022/01/07/texas-supreme-court-denies-dshs-request-to-ban-delta-8-thc/,414400,1641691691.0,0,,False,False,{},,,
1,2048,confidence,<praw.reddit.Reddit object at 0x7fbefadafc40>,,texas,"https://abc13.com/texas-politics-hemp-products-delta-8-classified-as-illegal-what-is/11141805/
I am so disappointed, and terrified right now, I already have anxiety and PTSD, and I have been using the Delta 8 as a focusing and calming medicine. Last Spring, I was a pain clinic patient who had been responsibly using opiods for 20 years. I had found D8 had reallyhelped with both my pain and also PTSD. Since it was legal, i had cleared it with my bosses, and voluntarily and without other assistance stopped opioids. I also was looking to change departments and was getting a permanent raise and position by transitioning from a contractor to a full time employee. When that happens I need to pass a drug screen within 45 days. So I was allowed to use any legal product in the state, and was changing jobs to get a nice raise. They don't care about medical THC by policy, and since D8 was legal I was totally OK and had cleared it.  I am now a felon having a small supply of cartridges, and smokable D8 hemp. I am a remote IT worker, I stay at home and don't bother anyone, and my job performance had drastically improved, hence my imminent promotion to full time. I was also in the process of applying to the Texas Compassionate use program because of PTSD, and now my good job is in jeopardy, and who knows about the T.CUP program now. Thanks Texas, I love you but your cannabis laws are unpredictable and capricious, and I was really doing well, and improving it feels like a huge step backwards for both me, and the entire state for rights and freedoms.

EDIT and Thanks! Good and kind folks of Texas, I truly and deeply appreciate all the good debate and input, regardless of if you agree or not, and I am also learning a good deal. I value all of the opinions and have tried to read and respond where I've been able, but at some point the depth of threads got too deep to keep up. I am headed to the doctors office and hoping to get a referral to T.CUP program if they can see me. they say they have walk in's and so I am assuming that includes cane-ins too.

EDIT EDIT--> Just in case anyone needs it: https://curt.dps.texas.gov/app/public/searchPhysician.xhtml

EDIT [the Last] I removed the reference to a medical condition as a comparison for the laws, it was insensitive. Sorry about that.

Epilog/TLDR: I am now, at least for the next few minutes, Texas's latest confirmed Medical MJ Patient. After my primary care physician confirmed my PTSD diagnosis, I had a virtual visit with one off the good doctors at https//texascannabisclinic.com/  and this afternoon my information is now in the database. Thanks to all who participated and especially to those negative opinions, bless your hearts, I understand you better too now. 

https://curt.dps.texas.gov/app/public/searchPhysician.xhtml",t2_1611mi,False,,0,False,"Texas has now banned Delta 8 THC, which has been legal and available in stores for months now, making me a felon.","[{'a': ':txpensive:', 'e': 'emoji', 'u': 'https://emoji.redditmedia.com/4y6pw1iyjtn51_t5_2qho4/txpensive'}]",r/texas,False,6,,0,,,False,t3_qbclqn,False,dark,0.92,,8110,10,{},,,False,[],,False,False,,{},,False,8110,,False,False,self,1634927922.0,,[],{'gid_1': 3},self,,True,public,1634653523.0,richtext,6,,,text,self.texas,True,"<!-- SC_OFF --><div class=""md""><p><a href=""https://abc13.com/texas-politics-hemp-products-delta-8-classified-as-illegal-what-is/11141805/"">https://abc13.com/texas-politics-hemp-products-delta-8-classified-as-illegal-what-is/11141805/</a>
I am so disappointed, and terrified right now, I already have anxiety and PTSD, and I have been using the Delta 8 as a focusing and calming medicine. Last Spring, I was a pain clinic patient who had been responsibly using opiods for 20 years. I had found D8 had reallyhelped with both my pain and also PTSD. Since it was legal, i had cleared it with my bosses, and voluntarily and without other assistance stopped opioids. I also was looking to change departments and was getting a permanent raise and position by transitioning from a contractor to a full time employee. When that happens I need to pass a drug screen within 45 days. So I was allowed to use any legal product in the state, and was changing jobs to get a nice raise. They don&#39;t care about medical THC by policy, and since D8 was legal I was totally OK and had cleared it.  I am now a felon having a small supply of cartridges, and smokable D8 hemp. I am a remote IT worker, I stay at home and don&#39;t bother anyone, and my job performance had drastically improved, hence my imminent promotion to full time. I was also in the process of applying to the Texas Compassionate use program because of PTSD, and now my good job is in jeopardy, and who knows about the T.CUP program now. Thanks Texas, I love you but your cannabis laws are unpredictable and capricious, and I was really doing well, and improving it feels like a huge step backwards for both me, and the entire state for rights and freedoms.</p>

<p>EDIT and Thanks! Good and kind folks of Texas, I truly and deeply appreciate all the good debate and input, regardless of if you agree or not, and I am also learning a good deal. I value all of the opinions and have tried to read and respond where I&#39;ve been able, but at some point the depth of threads got too deep to keep up. I am headed to the doctors office and hoping to get a referral to T.CUP program if they can see me. they say they have walk in&#39;s and so I am assuming that includes cane-ins too.</p>

<p>EDIT EDIT--&gt; Just in case anyone needs it: <a href=""https://curt.dps.texas.gov/app/public/searchPhysician.xhtml"">https://curt.dps.texas.gov/app/public/searchPhysician.xhtml</a></p>

<p>EDIT [the Last] I removed the reference to a medical condition as a comparison for the laws, it was insensitive. Sorry about that.</p>

<p>Epilog/TLDR: I am now, at least for the next few minutes, Texas&#39;s latest confirmed Medical MJ Patient. After my primary care physician confirmed my PTSD diagnosis, I had a virtual visit with one off the good doctors at https//texascannabisclinic.com/  and this afternoon my information is now in the database. Thanks to all who participated and especially to those negative opinions, bless your hearts, I understand you better too now. </p>

<p><a href=""https://curt.dps.texas.gov/app/public/searchPhysician.xhtml"">https://curt.dps.texas.gov/app/public/searchPhysician.xhtml</a></p>
</div><!-- SC_ON -->",,confidence,,,,False,False,False,False,False,"{'images': [{'source': {'url': 'https://external-preview.redd.it/0bp6JFZWhMjR1hMMYa6-BH187pjH0yPrtHHxY7buQAA.jpg?auto=webp&s=00b1310e35ad45aba9ece1ad6c27b00a491d6c9d', 'width': 1600, 'height': 900}, 'resolutions': [{'url': 'https://external-preview.redd.it/0bp6JFZWhMjR1hMMYa6-BH187pjH0yPrtHHxY7buQAA.jpg?width=108&crop=smart&auto=webp&s=3ccb97d505bfa047e0ce87f1067cf1967ecc8a12', 'width': 108, 'height': 60}, {'url': 'https://external-preview.redd.it/0bp6JFZWhMjR1hMMYa6-BH187pjH0yPrtHHxY7buQAA.jpg?width=216&crop=smart&auto=webp&s=3404c4d54df228fdcf314b74f8e4988e2e888933', 'width': 216, 'height': 121}, {'url': 'https://external-preview.redd.it/0bp6JFZWhMjR1hMMYa6-BH187pjH0yPrtHHxY7buQAA.jpg?width=320&crop=smart&auto=webp&s=3eab5137e8601e4418c18ed3595c78cd0ba6bb0b', 'width': 320, 'height': 180}, {'url': 'https://external-preview.redd.it/0bp6JFZWhMjR1hMMYa6-BH187pjH0yPrtHHxY7buQAA.jpg?width=640&crop=smart&auto=webp&s=4976c07b1dc92dc59c1c133d50995f0abcc5f381', 'width': 640, 'height': 360}, {'url': 'https://external-preview.redd.it/0bp6JFZWhMjR1hMMYa6-BH187pjH0yPrtHHxY7buQAA.jpg?width=960&crop=smart&auto=webp&s=ecd4f19fa445800f37345c8ad2fb65b8339890be', 'width': 960, 'height': 540}, {'url': 'https://external-preview.redd.it/0bp6JFZWhMjR1hMMYa6-BH187pjH0yPrtHHxY7buQAA.jpg?width=1080&crop=smart&auto=webp&s=9a01516f260f4521ea6b1f3d0ea48bf73a825869', 'width': 1080, 'height': 607}], 'variants': {}, 'id': 'JRTCmzP-vMQf17Nx4hHAzOwt34-2RbpgLCdpT6IB-f0'}], 'enabled': False}","[{'giver_coin_reward': None, 'subreddit_id': None, 'is_new': False, 'days_of_drip_extension': 0, 'coin_price': 100, 'id': 'gid_1', 'penny_donate': None, 'award_sub_type': 'GLOBAL', 'coin_reward': 0, 'icon_url': 'https://www.redditstatic.com/gold/awards/icon/silver_512.png', 'days_of_premium': 0, 'tiers_by_required_awardings': None, 'resized_icons': [{'url': 'https://www.redditstatic.com/gold/awards/icon/silver_16.png', 'width': 16, 'height': 16}, {'url': 'https://www.redditstatic.com/gold/awards/icon/silver_32.png', 'width': 32, 'height': 32}, {'url': 'https://www.redditstatic.com/gold/awards/icon/silver_48.png', 'width': 48, 'height': 48}, {'url': 'https://www.redditstatic.com/gold/awards/icon/silver_64.png', 'width': 64, 'height': 64}, {'url': 'https://www.redditstatic.com/gold/awards/icon/silver_128.png', 'width': 128, 'height': 128}], 'icon_width': 512, 'static_icon_width': 512, 'start_date': None, 'is_enabled': True, 'awardings_required_to_grant_benefits': None, 'description': ""Shows the Silver Award... and that's it."", 'end_date': None, 'subreddit_coin_reward': 0, 'count': 3, 'static_icon_height': 512, 'name': 'Silver', 'resized_static_icons': [{'url': 'https://www.redditstatic.com/gold/awards/icon/silver_16.png', 'width': 16, 'height': 16}, {'url': 'https://www.redditstatic.com/gold/awards/icon/silver_32.png', 'width': 32, 'height': 32}, {'url': 'https://www.redditstatic.com/gold/awards/icon/silver_48.png', 'width': 48, 'height': 48}, {'url': 'https://www.redditstatic.com/gold/awards/icon/silver_64.png', 'width': 64, 'height': 64}, {'url': 'https://www.redditstatic.com/gold/awards/icon/silver_128.png', 'width': 128, 'height': 128}], 'icon_format': None, 'icon_height': 512, 'penny_price': None, 'award_type': 'global', 'static_icon_url': 'https://www.redditstatic.com/gold/awards/icon/silver_512.png'}, {'giver_coin_reward': None, 'subreddit_id': None, 'is_new': False, 'days_of_drip_extension': 0, 'coin_price': 150, 'id': 'award_f44611f1-b89e-46dc-97fe-892280b13b82', 'penny_donate': None, 'award_sub_type': 'GLOBAL', 'coin_reward': 0, 'icon_url': 'https://i.redd.it/award_images/t5_22cerq/klvxk1wggfd41_Helpful.png', 'days_of_premium': 0, 'tiers_by_required_awardings': None, 'resized_icons': [{'url': 'https://preview.redd.it/award_images/t5_22cerq/klvxk1wggfd41_Helpful.png?width=16&height=16&auto=webp&s=a5662dfbdb402bf67866c050aa76c31c147c2f45', 'width': 16, 'height': 16}, {'url': 'https://preview.redd.it/award_images/t5_22cerq/klvxk1wggfd41_Helpful.png?width=32&height=32&auto=webp&s=a6882eb3f380e8e88009789f4d0072e17b8c59f1', 'width': 32, 'height': 32}, {'url': 'https://preview.redd.it/award_images/t5_22cerq/klvxk1wggfd41_Helpful.png?width=48&height=48&auto=webp&s=e50064b090879e8a0b55e433f6ee61d5cb5fbe1d', 'width': 48, 'height': 48}, {'url': 'https://preview.redd.it/award_images/t5_22cerq/klvxk1wggfd41_Helpful.png?width=64&height=64&auto=webp&s=8e5bb2e76683cb6b161830bcdd9642049d6adc11', 'width': 64, 'height': 64}, {'url': 'https://preview.redd.it/award_images/t5_22cerq/klvxk1wggfd41_Helpful.png?width=128&height=128&auto=webp&s=eda4a9246f95f42ee6940cc0ec65306fd20de878', 'width': 128, 'height': 128}], 'icon_width': 2048, 'static_icon_width': 2048, 'start_date': None, 'is_enabled': True, 'awardings_required_to_grant_benefits': None, 'description': 'Thank you stranger. Shows the award.', 'end_date': None, 'subreddit_coin_reward': 0, 'count': 2, 'static_icon_height': 2048, 'name': 'Helpful', 'resized_static_icons': [{'url': 'https://preview.redd.it/award_images/t5_22cerq/klvxk1wggfd41_Helpful.png?width=16&height=16&auto=webp&s=a5662dfbdb402bf67866c050aa76c31c147c2f45', 'width': 16, 'height': 16}, {'url': 'https://preview.redd.it/award_images/t5_22cerq/klvxk1wggfd41_Helpful.png?width=32&height=32&auto=webp&s=a6882eb3f380e8e88009789f4d0072e17b8c59f1', 'width': 32, 'height': 32}, {'url': 'https://preview.redd.it/award_images/t5_22cerq/klvxk1wggfd41_Helpful.png?width=48&height=48&auto=webp&s=e50064b090879e8a0b55e433f6ee61d5cb5fbe1d', 'width': 48, 'height': 48}, {'url': 'https://preview.redd.it/award_images/t5_22cerq/klvxk1wggfd41_Helpful.png?width=64&height=64&auto=webp&s=8e5bb2e76683cb6b161830bcdd9642049d6adc11', 'width': 64, 'height': 64}, {'url': 'https://preview.redd.it/award_images/t5_22cerq/klvxk1wggfd41_Helpful.png?width=128&height=128&auto=webp&s=eda4a9246f95f42ee6940cc0ec65306fd20de878', 'width': 128, 'height': 128}], 'icon_format': None, 'icon_height': 2048, 'penny_price': None, 'award_type': 'global', 'static_icon_url': 'https://i.redd.it/award_images/t5_22cerq/klvxk1wggfd41_Helpful.png'}, {'giver_coin_reward': None, 'subreddit_id': None, 'is_new': False, 'days_of_drip_extension': 0, 'coin_price': 125, 'id': 'award_5f123e3d-4f48-42f4-9c11-e98b566d5897', 'penny_donate': None, 'award_sub_type': 'GLOBAL', 'coin_reward': 0, 'icon_url': 'https://i.redd.it/award_images/t5_22cerq/5izbv4fn0md41_Wholesome.png', 'days_of_premium': 0, 'tiers_by_required_awardings': None, 'resized_icons': [{'url': 'https://preview.redd.it/award_images/t5_22cerq/5izbv4fn0md41_Wholesome.png?width=16&height=16&auto=webp&s=92932f465d58e4c16b12b6eac4ca07d27e3d11c0', 'width': 16, 'height': 16}, {'url': 'https://preview.redd.it/award_images/t5_22cerq/5izbv4fn0md41_Wholesome.png?width=32&height=32&auto=webp&s=d11484a208d68a318bf9d4fcf371171a1cb6a7ef', 'width': 32, 'height': 32}, {'url': 'https://preview.redd.it/award_images/t5_22cerq/5izbv4fn0md41_Wholesome.png?width=48&height=48&auto=webp&s=febdf28b6f39f7da7eb1365325b85e0bb49a9f63', 'width': 48, 'height': 48}, {'url': 'https://preview.redd.it/award_images/t5_22cerq/5izbv4fn0md41_Wholesome.png?width=64&height=64&auto=webp&s=b4406a2d88bf86fa3dc8a45aacf7e0c7bdccc4fb', 'width': 64, 'height': 64}, {'url': 'https://preview.redd.it/award_images/t5_22cerq/5izbv4fn0md41_Wholesome.png?width=128&height=128&auto=webp&s=19555b13e3e196b62eeb9160d1ac1d1b372dcb0b', 'width': 128, 'height': 128}], 'icon_width': 2048, 'static_icon_width': 2048, 'start_date': None, 'is_enabled': True, 'awardings_required_to_grant_benefits': None, 'description': 'When you come across a feel-good thing.', 'end_date': None, 'subreddit_coin_reward': 0, 'count': 1, 'static_icon_height': 2048, 'name': 'Wholesome', 'resized_static_icons': [{'url': 'https://preview.redd.it/award_images/t5_22cerq/5izbv4fn0md41_Wholesome.png?width=16&height=16&auto=webp&s=92932f465d58e4c16b12b6eac4ca07d27e3d11c0', 'width': 16, 'height': 16}, {'url': 'https://preview.redd.it/award_images/t5_22cerq/5izbv4fn0md41_Wholesome.png?width=32&height=32&auto=webp&s=d11484a208d68a318bf9d4fcf371171a1cb6a7ef', 'width': 32, 'height': 32}, {'url': 'https://preview.redd.it/award_images/t5_22cerq/5izbv4fn0md41_Wholesome.png?width=48&height=48&auto=webp&s=febdf28b6f39f7da7eb1365325b85e0bb49a9f63', 'width': 48, 'height': 48}, {'url': 'https://preview.redd.it/award_images/t5_22cerq/5izbv4fn0md41_Wholesome.png?width=64&height=64&auto=webp&s=b4406a2d88bf86fa3dc8a45aacf7e0c7bdccc4fb', 'width': 64, 'height': 64}, {'url': 'https://preview.redd.it/award_images/t5_22cerq/5izbv4fn0md41_Wholesome.png?width=128&height=128&auto=webp&s=19555b13e3e196b62eeb9160d1ac1d1b372dcb0b', 'width': 128, 'height': 128}], 'icon_format': None, 'icon_height': 2048, 'penny_price': None, 'award_type': 'global', 'static_icon_url': 'https://i.redd.it/award_images/t5_22cerq/5izbv4fn0md41_Wholesome.png'}, {'giver_coin_reward': 0, 'subreddit_id': None, 'is_new': False, 'days_of_drip_extension': 0, 'coin_price': 80, 'id': 'award_8352bdff-3e03-4189-8a08-82501dd8f835', 'penny_donate': 0, 'award_sub_type': 'GLOBAL', 'coin_reward': 0, 'icon_url': 'https://i.redd.it/award_images/t5_q0gj4/ks45ij6w05f61_oldHugz.png', 'days_of_premium': 0, 'tiers_by_required_awardings': None, 'resized_icons': [{'url': 'https://preview.redd.it/award_images/t5_q0gj4/ks45ij6w05f61_oldHugz.png?width=16&height=16&auto=webp&s=73a23bf7f08b633508dedf457f2704c522b94a04', 'width': 16, 'height': 16}, {'url': 'https://preview.redd.it/award_images/t5_q0gj4/ks45ij6w05f61_oldHugz.png?width=32&height=32&auto=webp&s=50f2f16e71d2929e3d7275060af3ad6b851dbfb1', 'width': 32, 'height': 32}, {'url': 'https://preview.redd.it/award_images/t5_q0gj4/ks45ij6w05f61_oldHugz.png?width=48&height=48&auto=webp&s=ca487311563425e195699a4d7e4c57a98cbfde8b', 'width': 48, 'height': 48}, {'url': 'https://preview.redd.it/award_images/t5_q0gj4/ks45ij6w05f61_oldHugz.png?width=64&height=64&auto=webp&s=7b4eedcffb1c09a826e7837532c52979760f1d2b', 'width': 64, 'height': 64}, {'url': 'https://preview.redd.it/award_images/t5_q0gj4/ks45ij6w05f61_oldHugz.png?width=128&height=128&auto=webp&s=e4d5ab237eb71a9f02bb3bf9ad5ee43741918d6c', 'width': 128, 'height': 128}], 'icon_width': 2048, 'static_icon_width': 2048, 'start_date': None, 'is_enabled': True, 'awardings_required_to_grant_benefits': None, 'description': 'Everything is better with a good hug', 'end_date': None, 'subreddit_coin_reward': 0, 'count': 4, 'static_icon_height': 2048, 'name': 'Hugz', 'resized_static_icons': [{'url': 'https://preview.redd.it/award_images/t5_q0gj4/fpm0r5ryq1361_PolarHugs.png?width=16&height=16&auto=webp&s=69997ace3ef4ffc099b81d774c2c8f1530602875', 'width': 16, 'height': 16}, {'url': 'https://preview.redd.it/award_images/t5_q0gj4/fpm0r5ryq1361_PolarHugs.png?width=32&height=32&auto=webp&s=e9519d1999ef9dce5c8a9f59369cb92f52d95319', 'width': 32, 'height': 32}, {'url': 'https://preview.redd.it/award_images/t5_q0gj4/fpm0r5ryq1361_PolarHugs.png?width=48&height=48&auto=webp&s=f076c6434fb2d2f9075991810fd845c40fa73fc6', 'width': 48, 'height': 48}, {'url': 'https://preview.redd.it/award_images/t5_q0gj4/fpm0r5ryq1361_PolarHugs.png?width=64&height=64&auto=webp&s=85527145e0c4b754306a30df29e584fd16187636', 'width': 64, 'height': 64}, {'url': 'https://preview.redd.it/award_images/t5_q0gj4/fpm0r5ryq1361_PolarHugs.png?width=128&height=128&auto=webp&s=b8843cdf82c3b741d7af057c14076dcd2621e811', 'width': 128, 'height': 128}], 'icon_format': 'PNG', 'icon_height': 2048, 'penny_price': 0, 'award_type': 'global', 'static_icon_url': 'https://i.redd.it/award_images/t5_q0gj4/fpm0r5ryq1361_PolarHugs.png'}]",[],False,849e7384-38c4-11eb-b167-0ee88904d009,False,False,False,,[],False,,,,t5_2qho4,False,,,,#dadada,qbclqn,True,,RedDogLost,,1572,True,all_ads,False,[],False,,/r/texas/comments/qbclqn/texas_has_now_banned_delta_8_thc_which_has_been/,all_ads,False,https://www.reddit.com/r/texas/comments/qbclqn/texas_has_now_banned_delta_8_thc_which_has_been/,414400,1634653523.0,3,,False,False,{},,,
2,2048,confidence,<praw.reddit.Reddit object at 0x7fbefadafc40>,,texas,"temporary injunction issued.  
no further details",t2_9bjq5,False,,0,False,Judge issues order making delta 8 legal in texas,"[{'a': ':Texas_House:', 'e': 'emoji', 'u': 'https://emoji.redditmedia.com/61vkpp5p9tt61_t5_2qho4/Texas_House'}, {'e': 'text', 't': ' Politics '}, {'a': ':Texas_Senate:', 'e': 'emoji', 'u': 'https://emoji.redditmedia.com/gdo7xfsl9tt61_t5_2qho4/Texas_Senate'}]",r/texas,False,6,pol,0,,,False,t3_qpi520,False,light,0.97,,961,0,{},,,False,[],,False,False,,{},:Texas_House: Politics :Texas_Senate:,False,961,,False,False,self,False,,[],{},,,True,public,1636391595.0,richtext,6,,,text,self.texas,True,"<!-- SC_OFF --><div class=""md""><p>temporary injunction issued.<br/>
no further details</p>
</div><!-- SC_ON -->",,confidence,,,,False,False,False,False,False,,[],[],False,bcf2e1ba-b375-11e8-b551-0e1da2ccb170,False,False,False,,[],False,,,,t5_2qho4,False,,,,#373c3f,qpi520,True,,rdking647,,197,True,all_ads,False,[],False,,/r/texas/comments/qpi520/judge_issues_order_making_delta_8_legal_in_texas/,all_ads,False,https://www.reddit.com/r/texas/comments/qpi520/judge_issues_order_making_delta_8_legal_in_texas/,414400,1636391595.0,0,,False,False,{},,,
