23,2048,confidence,<praw.reddit.Reddit object at 0x7fbefadafc40>,,texas,"I am starting to see a lot of people around Texas (I frequently drive from Austin to Dallas, and Austin to Houston) without masks on. Namely at the bank today I was walking in and the guy behind me didn't have a mask on.

Please please please people, keep wearing your mask! We need to beat this thing and with the delta variants things could get scary really soon! Don't take it from me, even CNN has been reporting rise of the delta variant: [https://www.cnn.com/2021/06/22/health/covid-variant-delta-gamma/index.html](https://www.cnn.com/2021/06/22/health/covid-variant-delta-gamma/index.html)

I'm just asking as a public service. Masking isn't hard, and it can be fun with all the designs they have available. Most places will provide you one for free if you ask! PLEASE MASK UP! Get vaccinated too!

And always remember, the only true goal is zero! Zero death, zero new cases.",t2_c4np0b4r,False,,0,False,PSA - Please wear your mask! Pretty please!,"[{'e': 'text', 't': 'Texas Health'}]",r/texas,False,6,,0,,,False,t3_o6m5m5,False,light,0.31,,0,0,{},,,False,[],,False,False,,{},Texas Health,False,0,,False,False,self,False,,[],{},self,,True,public,1624482845.0,richtext,6,,,text,self.texas,False,"<!-- SC_OFF --><div class=""md""><p>I am starting to see a lot of people around Texas (I frequently drive from Austin to Dallas, and Austin to Houston) without masks on. Namely at the bank today I was walking in and the guy behind me didn&#39;t have a mask on.</p>

<p>Please please please people, keep wearing your mask! We need to beat this thing and with the delta variants things could get scary really soon! Don&#39;t take it from me, even CNN has been reporting rise of the delta variant: <a href=""https://www.cnn.com/2021/06/22/health/covid-variant-delta-gamma/index.html"">https://www.cnn.com/2021/06/22/health/covid-variant-delta-gamma/index.html</a></p>

<p>I&#39;m just asking as a public service. Masking isn&#39;t hard, and it can be fun with all the designs they have available. Most places will provide you one for free if you ask! PLEASE MASK UP! Get vaccinated too!</p>

<p>And always remember, the only true goal is zero! Zero death, zero new cases.</p>
</div><!-- SC_ON -->",,confidence,,,,True,True,False,False,False,"{'images': [{'source': {'url': 'https://external-preview.redd.it/X3VBz_hJs5HcipZ39yPwER4-SUebBYQw9nHOnBIjlMg.jpg?auto=webp&s=828ac0a7c8df6d7cd05fcf6f7922bee58d37b669', 'width': 1100, 'height': 619}, 'resolutions': [{'url': 'https://external-preview.redd.it/X3VBz_hJs5HcipZ39yPwER4-SUebBYQw9nHOnBIjlMg.jpg?width=108&crop=smart&auto=webp&s=9c6db7479c865df72db74f136bd7481f6886de52', 'width': 108, 'height': 60}, {'url': 'https://external-preview.redd.it/X3VBz_hJs5HcipZ39yPwER4-SUebBYQw9nHOnBIjlMg.jpg?width=216&crop=smart&auto=webp&s=61ab690b9ba2ee6a9ceb5e94e18c876d3d54cb44', 'width': 216, 'height': 121}, {'url': 'https://external-preview.redd.it/X3VBz_hJs5HcipZ39yPwER4-SUebBYQw9nHOnBIjlMg.jpg?width=320&crop=smart&auto=webp&s=40af76e80ddb2e4f1bc9123fbb9949d0507020fb', 'width': 320, 'height': 180}, {'url': 'https://external-preview.redd.it/X3VBz_hJs5HcipZ39yPwER4-SUebBYQw9nHOnBIjlMg.jpg?width=640&crop=smart&auto=webp&s=31c4968e009a758f6b809c812469f6624ea54339', 'width': 640, 'height': 360}, {'url': 'https://external-preview.redd.it/X3VBz_hJs5HcipZ39yPwER4-SUebBYQw9nHOnBIjlMg.jpg?width=960&crop=smart&auto=webp&s=d3a21e58dc26656b4563f3095e4405990edb45e5', 'width': 960, 'height': 540}, {'url': 'https://external-preview.redd.it/X3VBz_hJs5HcipZ39yPwER4-SUebBYQw9nHOnBIjlMg.jpg?width=1080&crop=smart&auto=webp&s=28b95cccf375d16653f3657e5a6902ad393cb70d', 'width': 1080, 'height': 607}], 'variants': {}, 'id': 'ge0qn7Z_ONkx1GJSgFQyEhjctEqFR74o_cRyNE6Fj6c'}], 'enabled': False}",[],[],False,c15de0f8-46ac-11ea-b950-0e4f28efbb49,False,False,False,,[],False,,,,t5_2qho4,False,,,,#373c3f,o6m5m5,True,,JustSomeMildDrama,,50,True,all_ads,False,[],False,,/r/texas/comments/o6m5m5/psa_please_wear_your_mask_pretty_please/,all_ads,False,https://www.reddit.com/r/texas/comments/o6m5m5/psa_please_wear_your_mask_pretty_please/,414400,1624482845.0,0,,False,False,{},,,
24,2048,confidence,<praw.reddit.Reddit object at 0x7fbefadafc40>,,texas,"""the earliest published composition known to link the condition of having the blues to the musical form that would become popularly known as 'the blues.' ""Hart Wand's ""Dallas Blues"" was published in 1912
then came Blind lemon Jefferson in the mid 20's who was "" the first true bluesman as we know it""
Robert Johnsons ""The king of Mississippi delta blues"" recorded both of his recordings in Texas(San Antonio for his famous ""Crossroads Blues"" and dallas for his last recordings...and Freddie King, the biggest of the Chicago blues was a texan...Texas not only was the first to play the blues, but was responsible for the best of the other 2 blues movements
then Came Bob Wills which brought the Blues to the Whites more than any other, and created western swing...A pioneer for Rock, and Country...Still known as ""The King""
then early Country that Influenced rock from people like Ernest Tubb, George Jones, Jim Reeves, and Ray price came
and the pioneers of Rock n Roll Roy Orbinson, and buddy holly...
and Willie Nelson, and Waylon Jennings pioneering Outlaw country, and influencing rock
then came ZZ top
then...Then came Stevie Ray Vaughan...the last of the Bluesmen, who once again bridged the gap between blues and Rock...The greatest Guitar player to ever live.. 
...
Texas lead the way for Blues, Country, and Rock...
the creator of all 3",t2_3ipq78by,False,,0,False,Texas was the most important place for music of the 20th century,"[{'e': 'text', 't': 'Music'}]",r/texas,False,6,,0,,,False,t3_g7pxlt,False,light,0.68,,7,0,{},,,False,[],,False,False,,{},Music,False,7,,False,False,self,False,,[],{},,,True,public,1587802081.0,richtext,6,,,text,self.texas,False,"<!-- SC_OFF --><div class=""md""><p>&quot;the earliest published composition known to link the condition of having the blues to the musical form that would become popularly known as &#39;the blues.&#39; &quot;Hart Wand&#39;s &quot;Dallas Blues&quot; was published in 1912
then came Blind lemon Jefferson in the mid 20&#39;s who was &quot; the first true bluesman as we know it&quot;
Robert Johnsons &quot;The king of Mississippi delta blues&quot; recorded both of his recordings in Texas(San Antonio for his famous &quot;Crossroads Blues&quot; and dallas for his last recordings...and Freddie King, the biggest of the Chicago blues was a texan...Texas not only was the first to play the blues, but was responsible for the best of the other 2 blues movements
then Came Bob Wills which brought the Blues to the Whites more than any other, and created western swing...A pioneer for Rock, and Country...Still known as &quot;The King&quot;
then early Country that Influenced rock from people like Ernest Tubb, George Jones, Jim Reeves, and Ray price came
and the pioneers of Rock n Roll Roy Orbinson, and buddy holly...
and Willie Nelson, and Waylon Jennings pioneering Outlaw country, and influencing rock
then came ZZ top
then...Then came Stevie Ray Vaughan...the last of the Bluesmen, who once again bridged the gap between blues and Rock...The greatest Guitar player to ever live.. 
...
Texas lead the way for Blues, Country, and Rock...
the creator of all 3</p>
</div><!-- SC_ON -->",,confidence,,,,True,False,False,False,False,,[],[],False,2bb7475a-cfef-11e7-a5dd-0e6cecd3d9fa,False,False,False,,[],False,,,,t5_2qho4,False,,,,#373c3f,g7pxlt,True,,Duke_of_Mecklenburg,,3,True,all_ads,False,[],False,,/r/texas/comments/g7pxlt/texas_was_the_most_important_place_for_music_of/,all_ads,False,https://www.reddit.com/r/texas/comments/g7pxlt/texas_was_the_most_important_place_for_music_of/,414400,1587802081.0,0,,False,False,{},,,
25,2048,confidence,<praw.reddit.Reddit object at 0x7fbefadafc40>,,texas,"Dear Governor Abbott,

As I know you are aware, the 84th Texas Legislature is currently underway, and there have been several cannabis-related bills proposed, one of which is HB 507. HB 507 would, as you know allow for possession of marijuana under one ounce to be punishable by only up to a $100 fine. From what I have read, you do not support decriminalization or legalization of cannabis on any level, and have stated that you will veto any cannabis-related legislation that is proposed. Why would you veto a bill that could potentially save and enhance lives? You stated that it would be because cannabis is a Schedule I drug, which means that it has a high potential for abuse as well as having no known medical applications. 

In regards to cannabis, both of these statements are utterly false. Cannabidiol (CBD), as well delta-9-tetrahydrocannabinol (THC, the psychoactive compound in cannabis) have both been shown to have medical applications. While CBD is primarily used to treat epilepsy, inflammation, and chronic pain, THC has a similar amount of medical applications as CBD. THC is used to treat anxiety, depression, and nausea among other things. However, in order to get the greatest benefit from cannabis, both THC and CBD must be administered together. When administered simultaneously, CBD and THC are used to treat symptoms of multiple sclerosis, cancer and chemotherapy, and many more debilitating illnesses. So I ask you again, â€œWhy would you veto a bill that could potentially save and enhance lives?â€

As for cannabis having the potential for addiction, you could apply that to almost anything. Technically caffeine is addictive, and the majority of people who consume it are addicted. Unlike cannabis however, caffeine has physical withdrawal symptoms upon discontinuing consumption. Alcohol is most definitely addictive, and substantially more dangerous than caffeine and cannabis. One other point Iâ€™d like to make in regard to the argument â€œcannabis is addictiveâ€ has to do with antidepressants. If someone has to take an antidepressant every day for the rest of their lives in order to function in society, we donâ€™t call them an addict. We acknowledge that they take this medication so that they will feel better. Also, antidepressants like SSRIs have actually been shown to have the potential to do more damage than cannabis, damage which could be permanent. I have permanent neurological damage from taking fluoxetine (Prozac) for three years.

Let me tell you of my personal experience with cannabis, and how it drastically improved my quality of life. 

First, a bit of background:
I am a nineteen-year old woman who has suffered from epilepsy, psoriasis and other autoimmune disorders, nausea and extreme weight loss associated with treatments for autoimmune disorders, and anxiety and depression for most of my life. I struggled throughout elementary, middle, and high school as a result of these things. I frequently missed school because I would have seizures, or experience adverse side-effects as a result of taking anticonvulsants to treat the seizures (which hardly made an improvement to begin with). I was ridiculed and ostracized by my peers due to my psoriasis, which in turn led to depression and anxiety that still plague me to this day. 

But then, after high school, I tried cannabis for the first time. I didnâ€™t feel nauseated, and actually managed to eat a full meal for the first time in years. On top of that, I had the confidence to speak to people, a confidence I had never before experienced. I bought cannabis for the first time the next day. I knew I had finally found something that would be able to help me, but I was also terrified of the consequences of getting caught with it. I started taking between one and three inhales of cannabis per night, and began to notice the frequency of my seizures gradually decreasing. Eventually they stopped altogether, and I was able to discontinue taking the anticonvulsants. 

Another thing I noticed, which I had not expected, was that my skin began to clear up rapidly. Before that, I had never felt like I was very attractive, and had thus avoided most social interaction. However, once I started to see my skin clearing up, I gained enough confidence to actually be able to talk to people, and subsequently make friends. 

Despite the misconception that cannabis makes people lazy, I did very well in college. My quality of life had improved significantly. Then, this past January, I was arrested for possession of marijuana under two ounces; a Class B Misdemeanor for possessing a plant that helped me be able to function in day-to-day life. I havenâ€™t consumed cannabis since the arrest due to fear of getting in more trouble. I was in jail of over twenty-four hours, and have lost every bit of confidence I once had. All of the progress I had made in regards to epilepsy has been reversed, and the psoriasis has come back with a vengeance, despite being on a medication that is supposed to treat it. Iâ€™ve ended up in the emergency room three times since January due to my epilepsy, and I am hesitant to start taking anticonvulsant medications again, seeing as for me, they ultimately did more harm than good. I have lost all of the weight I had gained, and am now underweight and have malnutrition. I also have crippling depression because I am too sick a lot of the time to get on with my life. I want to be a neurobiologist, but I canâ€™t do that if I canâ€™t even get out of bed most days. As for my criminal record, I am not a criminal. I am a woman who is ill and was trying to feel better. It frustrates me that I know how to help myself, I know what I need to do in order to accomplish my goals, but even attempting to do that could have serious ramifications.

So, Governor Abbott, I ask you for the last time, â€œWhy would you veto a bill that could potentially save and enhance lives?â€

**(edited to add the third paragraph)**",t2_mgucv,False,,0,False,My letter to Governor Abbot regarding HB 507. Please read and comment. Should I send it? [x-post from r/DFWEnts](http://www.reddit.com/r/DFWEnts/),[],r/texas,False,6,,0,,,False,t3_35w1m0,False,dark,0.73,,5,0,{},,,False,[],,False,False,,{},,False,5,,False,False,self,1431569771.0,,[],{},,,True,public,1431561546.0,text,6,,,text,self.texas,False,"<!-- SC_OFF --><div class=""md""><p>Dear Governor Abbott,</p>

<p>As I know you are aware, the 84th Texas Legislature is currently underway, and there have been several cannabis-related bills proposed, one of which is HB 507. HB 507 would, as you know allow for possession of marijuana under one ounce to be punishable by only up to a $100 fine. From what I have read, you do not support decriminalization or legalization of cannabis on any level, and have stated that you will veto any cannabis-related legislation that is proposed. Why would you veto a bill that could potentially save and enhance lives? You stated that it would be because cannabis is a Schedule I drug, which means that it has a high potential for abuse as well as having no known medical applications. </p>

<p>In regards to cannabis, both of these statements are utterly false. Cannabidiol (CBD), as well delta-9-tetrahydrocannabinol (THC, the psychoactive compound in cannabis) have both been shown to have medical applications. While CBD is primarily used to treat epilepsy, inflammation, and chronic pain, THC has a similar amount of medical applications as CBD. THC is used to treat anxiety, depression, and nausea among other things. However, in order to get the greatest benefit from cannabis, both THC and CBD must be administered together. When administered simultaneously, CBD and THC are used to treat symptoms of multiple sclerosis, cancer and chemotherapy, and many more debilitating illnesses. So I ask you again, â€œWhy would you veto a bill that could potentially save and enhance lives?â€</p>

<p>As for cannabis having the potential for addiction, you could apply that to almost anything. Technically caffeine is addictive, and the majority of people who consume it are addicted. Unlike cannabis however, caffeine has physical withdrawal symptoms upon discontinuing consumption. Alcohol is most definitely addictive, and substantially more dangerous than caffeine and cannabis. One other point Iâ€™d like to make in regard to the argument â€œcannabis is addictiveâ€ has to do with antidepressants. If someone has to take an antidepressant every day for the rest of their lives in order to function in society, we donâ€™t call them an addict. We acknowledge that they take this medication so that they will feel better. Also, antidepressants like SSRIs have actually been shown to have the potential to do more damage than cannabis, damage which could be permanent. I have permanent neurological damage from taking fluoxetine (Prozac) for three years.</p>

<p>Let me tell you of my personal experience with cannabis, and how it drastically improved my quality of life. </p>

<p>First, a bit of background:
I am a nineteen-year old woman who has suffered from epilepsy, psoriasis and other autoimmune disorders, nausea and extreme weight loss associated with treatments for autoimmune disorders, and anxiety and depression for most of my life. I struggled throughout elementary, middle, and high school as a result of these things. I frequently missed school because I would have seizures, or experience adverse side-effects as a result of taking anticonvulsants to treat the seizures (which hardly made an improvement to begin with). I was ridiculed and ostracized by my peers due to my psoriasis, which in turn led to depression and anxiety that still plague me to this day. </p>

<p>But then, after high school, I tried cannabis for the first time. I didnâ€™t feel nauseated, and actually managed to eat a full meal for the first time in years. On top of that, I had the confidence to speak to people, a confidence I had never before experienced. I bought cannabis for the first time the next day. I knew I had finally found something that would be able to help me, but I was also terrified of the consequences of getting caught with it. I started taking between one and three inhales of cannabis per night, and began to notice the frequency of my seizures gradually decreasing. Eventually they stopped altogether, and I was able to discontinue taking the anticonvulsants. </p>

<p>Another thing I noticed, which I had not expected, was that my skin began to clear up rapidly. Before that, I had never felt like I was very attractive, and had thus avoided most social interaction. However, once I started to see my skin clearing up, I gained enough confidence to actually be able to talk to people, and subsequently make friends. </p>

<p>Despite the misconception that cannabis makes people lazy, I did very well in college. My quality of life had improved significantly. Then, this past January, I was arrested for possession of marijuana under two ounces; a Class B Misdemeanor for possessing a plant that helped me be able to function in day-to-day life. I havenâ€™t consumed cannabis since the arrest due to fear of getting in more trouble. I was in jail of over twenty-four hours, and have lost every bit of confidence I once had. All of the progress I had made in regards to epilepsy has been reversed, and the psoriasis has come back with a vengeance, despite being on a medication that is supposed to treat it. Iâ€™ve ended up in the emergency room three times since January due to my epilepsy, and I am hesitant to start taking anticonvulsant medications again, seeing as for me, they ultimately did more harm than good. I have lost all of the weight I had gained, and am now underweight and have malnutrition. I also have crippling depression because I am too sick a lot of the time to get on with my life. I want to be a neurobiologist, but I canâ€™t do that if I canâ€™t even get out of bed most days. As for my criminal record, I am not a criminal. I am a woman who is ill and was trying to feel better. It frustrates me that I know how to help myself, I know what I need to do in order to accomplish my goals, but even attempting to do that could have serious ramifications.</p>

<p>So, Governor Abbott, I ask you for the last time, â€œWhy would you veto a bill that could potentially save and enhance lives?â€</p>

<p><strong>(edited to add the third paragraph)</strong></p>
</div><!-- SC_ON -->",,confidence,,,,True,True,False,False,False,,[],[],False,,False,False,False,,[],False,,,,t5_2qho4,False,,,,,35w1m0,True,,IngeniusStupidity,,1,True,all_ads,False,[],False,,/r/texas/comments/35w1m0/my_letter_to_governor_abbot_regarding_hb_507/,all_ads,False,https://www.reddit.com/r/texas/comments/35w1m0/my_letter_to_governor_abbot_regarding_hb_507/,414400,1431561546.0,0,,False,False,{},,,
