3,2048,confidence,<praw.reddit.Reddit object at 0x7fbefadafc40>,,texas,,t2_3q5hnq8z,False,,0,False,Texas Supreme Court dismisses request from state health department for action in Delta-8 THC battle,"[{'e': 'text', 't': 'News'}]",r/texas,False,6,,0,112.0,,False,t3_rhw582,False,light,0.98,,762,0,{},140.0,,False,[],,False,False,,{},News,False,762,,False,False,https://b.thumbs.redditmedia.com/_Lq37JCZk6XhFuGDs0LEUsjRfUBcWKJlTk-1qAFoa2s.jpg,False,,[],{},link,,False,public,1639677383.0,richtext,6,,,text,nothingbuthemp.net,False,,,confidence,,https://www.nothingbuthemp.net/post/texas-supreme-court-dismisses-request-from-state-health-department-for-action-in-delta-8-thc-battle,,False,False,False,False,False,"{'images': [{'source': {'url': 'https://external-preview.redd.it/J_aJ06NiYx8w1E1_COy3bwubTt7gM9OIKfTHJRAD-Cs.jpg?auto=webp&s=e9e7b0ac4b90bb58aa67858fe36338443df9f142', 'width': 700, 'height': 560}, 'resolutions': [{'url': 'https://external-preview.redd.it/J_aJ06NiYx8w1E1_COy3bwubTt7gM9OIKfTHJRAD-Cs.jpg?width=108&crop=smart&auto=webp&s=fd99ec0414bc3794a2132e21aba0477f77a090e6', 'width': 108, 'height': 86}, {'url': 'https://external-preview.redd.it/J_aJ06NiYx8w1E1_COy3bwubTt7gM9OIKfTHJRAD-Cs.jpg?width=216&crop=smart&auto=webp&s=5adc4e4e8d19de613662eb9bc3be42303dd7a092', 'width': 216, 'height': 172}, {'url': 'https://external-preview.redd.it/J_aJ06NiYx8w1E1_COy3bwubTt7gM9OIKfTHJRAD-Cs.jpg?width=320&crop=smart&auto=webp&s=2fcc336c53a7f16b43238acf6f7eeb34bf534fe7', 'width': 320, 'height': 256}, {'url': 'https://external-preview.redd.it/J_aJ06NiYx8w1E1_COy3bwubTt7gM9OIKfTHJRAD-Cs.jpg?width=640&crop=smart&auto=webp&s=c1db9e18b1c7cc7b15282ca453a8f0a5d9e401ec', 'width': 640, 'height': 512}], 'variants': {}, 'id': 'TfT14vqFnWzDKRFylY0JEdPTNAJZznxihfnkDMR_Ov8'}], 'enabled': False}",[],[],False,dd1d9f22-d066-11e7-a592-0e9f2c9b3e5c,False,False,False,,[],False,,,,t5_2qho4,False,,,,#373c3f,rhw582,True,,MedicalAd7014,,189,True,all_ads,False,[],False,,/r/texas/comments/rhw582/texas_supreme_court_dismisses_request_from_state/,all_ads,False,https://www.nothingbuthemp.net/post/texas-supreme-court-dismisses-request-from-state-health-department-for-action-in-delta-8-thc-battle,414400,1639677383.0,0,,False,False,{},,,
4,2048,confidence,<praw.reddit.Reddit object at 0x7fbefadafc40>,,texas,,t2_a3lrvb2z,False,,0,False,Delta-8 illegal again in TX as state appeals injunction - Texas Cannabis Collective,"[{'e': 'text', 't': 'News'}]",r/texas,False,6,,0,78.0,,False,t3_qro3qh,False,light,0.95,,637,0,{},140.0,,False,[],,False,False,,{},News,False,637,,False,False,https://b.thumbs.redditmedia.com/Q04TWWu3pvsjVcOSElbt7DoUHqFpUZREXIcqFY7bjeE.jpg,False,,[],{},link,,False,public,1636645630.0,richtext,6,,,text,txcannaco.com,True,,,confidence,,https://txcannaco.com/delta-8-illegal-again-in-tx-as-state-appeals-injunction/,,False,False,False,False,False,"{'images': [{'source': {'url': 'https://external-preview.redd.it/HZcvV-tSzhwVvEGQrHkY360uxyegYJPdPP3tG2Kq9EI.jpg?auto=webp&s=631dc59705fc5041fb2549e94d2c645837cec9fe', 'width': 960, 'height': 540}, 'resolutions': [{'url': 'https://external-preview.redd.it/HZcvV-tSzhwVvEGQrHkY360uxyegYJPdPP3tG2Kq9EI.jpg?width=108&crop=smart&auto=webp&s=fe8dbe5879f0c2ee740096576a2ea86cd5e1ddd9', 'width': 108, 'height': 60}, {'url': 'https://external-preview.redd.it/HZcvV-tSzhwVvEGQrHkY360uxyegYJPdPP3tG2Kq9EI.jpg?width=216&crop=smart&auto=webp&s=b9fd79ddfd241c1a886148a882e50ad2ca158e46', 'width': 216, 'height': 121}, {'url': 'https://external-preview.redd.it/HZcvV-tSzhwVvEGQrHkY360uxyegYJPdPP3tG2Kq9EI.jpg?width=320&crop=smart&auto=webp&s=9fbbc300916b671f7102afaeaed3ddfba658156c', 'width': 320, 'height': 180}, {'url': 'https://external-preview.redd.it/HZcvV-tSzhwVvEGQrHkY360uxyegYJPdPP3tG2Kq9EI.jpg?width=640&crop=smart&auto=webp&s=b4262f7cdeae7ec4668a15394778068991aa8e03', 'width': 640, 'height': 360}, {'url': 'https://external-preview.redd.it/HZcvV-tSzhwVvEGQrHkY360uxyegYJPdPP3tG2Kq9EI.jpg?width=960&crop=smart&auto=webp&s=460b1a47c11f3494f9abc7a692d2b0cfd655130d', 'width': 960, 'height': 540}], 'variants': {}, 'id': 'oBam6QYM3WeT9J1Siv_b5MU7-D2dxYyEKU6kHtX3UBA'}], 'enabled': False}",[],[],False,dd1d9f22-d066-11e7-a592-0e9f2c9b3e5c,False,False,False,,[],False,,,,t5_2qho4,False,,,,#373c3f,qro3qh,True,,TXCANNACO,,344,True,all_ads,False,[],False,,/r/texas/comments/qro3qh/delta8_illegal_again_in_tx_as_state_appeals/,all_ads,False,https://txcannaco.com/delta-8-illegal-again-in-tx-as-state-appeals-injunction/,414400,1636645630.0,1,,False,False,{},,,
5,2048,confidence,<praw.reddit.Reddit object at 0x7fbefadafc40>,,texas,"Since we are getting multiple posts a day in regards to this topic I've created this megathread for it.  Below are some article links for reference.  Enjoy your discussions.

[Delta-8 THC is illegal, Texas Department of State Health Services says](https://www.fox7austin.com/news/delta-8-thc-is-illegal-texas-department-of-state-health-services-says)

[In a Surprise Move Texas Outlaws Pot-like Delta-8 THC](https://sanangelolive.com/news/crime/2021-10-20/surprise-move-texas-outlaws-pot-delta-8-thc)

[Pay Walled article from the Dallas News](https://www.dallasnews.com/news/politics/2021/10/19/delta-8-thc-products-illegal-in-texas-updated-health-department-website-says/)

 [After Texas Regulators Say Delta-8 Is Illegal, Some Companies Plan to Fight Back](https://www.dallasobserver.com/news/texas-regulators-say-delta-8-is-illegal-these-companies-say-no-way-12652551)",t2_5c0qjcv2,False,,0,False,Delta-8 Megathread,[],r/texas,False,6,,0,,,False,t3_qcq9ck,False,dark,0.94,#373c3f,190,0,{},,443e7dec-b2d4-11e9-b93d-0e09ddc5da20,False,[],,False,False,,{},,False,190,,False,True,self,False,,"[{'e': 'text', 't': 'The Stars at Night'}, {'a': ':txflagtx:', 'e': 'emoji', 'u': 'https://emoji.redditmedia.com/pdrmvb8yjtn51_t5_2qho4/txflagtx'}]",{},self,,True,public,1634817943.0,text,6,,,richtext,self.texas,True,"<!-- SC_OFF --><div class=""md""><p>Since we are getting multiple posts a day in regards to this topic I&#39;ve created this megathread for it.  Below are some article links for reference.  Enjoy your discussions.</p>

<p><a href=""https://www.fox7austin.com/news/delta-8-thc-is-illegal-texas-department-of-state-health-services-says"">Delta-8 THC is illegal, Texas Department of State Health Services says</a></p>

<p><a href=""https://sanangelolive.com/news/crime/2021-10-20/surprise-move-texas-outlaws-pot-delta-8-thc"">In a Surprise Move Texas Outlaws Pot-like Delta-8 THC</a></p>

<p><a href=""https://www.dallasnews.com/news/politics/2021/10/19/delta-8-thc-products-illegal-in-texas-updated-health-department-website-says/"">Pay Walled article from the Dallas News</a></p>

<p><a href=""https://www.dallasobserver.com/news/texas-regulators-say-delta-8-is-illegal-these-companies-say-no-way-12652551"">After Texas Regulators Say Delta-8 Is Illegal, Some Companies Plan to Fight Back</a></p>
</div><!-- SC_ON -->",,confidence,,,,False,False,False,False,False,"{'images': [{'source': {'url': 'https://external-preview.redd.it/rGJ8Pga6YPtJm8WfQaJTIAWzM1S7e75YdHdf6ZD8sOU.jpg?auto=webp&s=3aa9b75d6f36d9d5a8d8ed7d55986b59d8df6165', 'width': 1083, 'height': 609}, 'resolutions': [{'url': 'https://external-preview.redd.it/rGJ8Pga6YPtJm8WfQaJTIAWzM1S7e75YdHdf6ZD8sOU.jpg?width=108&crop=smart&auto=webp&s=aaba8391c7d7fa8c42acc8a2b5b9eb48f9e91fdb', 'width': 108, 'height': 60}, {'url': 'https://external-preview.redd.it/rGJ8Pga6YPtJm8WfQaJTIAWzM1S7e75YdHdf6ZD8sOU.jpg?width=216&crop=smart&auto=webp&s=34094b4848fa3c6ded77d0bb5a4e28736a1e1383', 'width': 216, 'height': 121}, {'url': 'https://external-preview.redd.it/rGJ8Pga6YPtJm8WfQaJTIAWzM1S7e75YdHdf6ZD8sOU.jpg?width=320&crop=smart&auto=webp&s=4dc57e1af055ebc7795ef892558e930bf9fe7543', 'width': 320, 'height': 179}, {'url': 'https://external-preview.redd.it/rGJ8Pga6YPtJm8WfQaJTIAWzM1S7e75YdHdf6ZD8sOU.jpg?width=640&crop=smart&auto=webp&s=4189b800aaa427898b3c43257113ccbd9f99b8ad', 'width': 640, 'height': 359}, {'url': 'https://external-preview.redd.it/rGJ8Pga6YPtJm8WfQaJTIAWzM1S7e75YdHdf6ZD8sOU.jpg?width=960&crop=smart&auto=webp&s=8a7106e49d8264b38b12ef193eb64c8739458a8a', 'width': 960, 'height': 539}, {'url': 'https://external-preview.redd.it/rGJ8Pga6YPtJm8WfQaJTIAWzM1S7e75YdHdf6ZD8sOU.jpg?width=1080&crop=smart&auto=webp&s=6a24e252c4c23083c0d1b4e0d6b2d019b4e2b305', 'width': 1080, 'height': 607}], 'variants': {}, 'id': '8R6Bb2SgYBTJdxMca9KXp17K-leS4nbtgpDWTtqoEqo'}], 'enabled': False}",[],[],False,,False,False,False,The Stars at Night:txflagtx:,[],False,,,,t5_2qho4,False,,,,,qcq9ck,True,,Darth_Texan,,181,True,all_ads,False,[],False,light,/r/texas/comments/qcq9ck/delta8_megathread/,all_ads,False,https://www.reddit.com/r/texas/comments/qcq9ck/delta8_megathread/,414400,1634817943.0,0,,False,False,{},,,
6,2048,confidence,<praw.reddit.Reddit object at 0x7fbefadafc40>,,texas,"Hey yâ€™all! Just wondering if any Texans that use legal hemp/delta 8 thc could help my wife and I out with some feedback? Anything would be appreciated guys and gals ðŸ™‚

We were both born and raised in TX and have been using cannabis over 15 years +. When we had our kids years back, We had to find another alternative and dove deep into researching the legal cannabinoids that you could use in Texas.

Ever since that, Iâ€™ve been using cbd flower, delta 8 thc & other cannabinoids. The thing I notice, prices were way too high at my local shops in town for just a g of really brown cbd flower or $40 for cart .

My wife and I always wanted to work side by side . So we finally went for it and we got our hemp retail license a few months back in Lockhart, TX. 

Our main thing, especially in TX is offer better pricing and help those that canâ€™t get into the medical program for TX. I canâ€™t believe that someone is charging 80+ for a tincture with hardly any thc. Since we sell locally at flea markets, we can be cheaper than retail store. 

So far, weâ€™ve been bringing in products weâ€™ve personally used & working with a glass blower from WA. 

Hereâ€™s my question. 

Are there certain products yâ€™all like using? What pricing would you like to see? And is there certain hemp/cannabinoids youâ€™d like to see more of?",t2_8uzmf1iq,False,,0,False,Any Texans that use hemp/delta 8 thc?,"[{'e': 'text', 't': 'Questions for Texans'}]",r/texas,False,6,,0,,,False,t3_s0ssz1,False,light,0.62,,4,0,{},,,False,[],,False,False,,{},Questions for Texans,False,4,,False,False,self,False,,[],{},,,True,public,1641844354.0,richtext,6,,,text,self.texas,False,"<!-- SC_OFF --><div class=""md""><p>Hey yâ€™all! Just wondering if any Texans that use legal hemp/delta 8 thc could help my wife and I out with some feedback? Anything would be appreciated guys and gals ðŸ™‚</p>

<p>We were both born and raised in TX and have been using cannabis over 15 years +. When we had our kids years back, We had to find another alternative and dove deep into researching the legal cannabinoids that you could use in Texas.</p>

<p>Ever since that, Iâ€™ve been using cbd flower, delta 8 thc &amp; other cannabinoids. The thing I notice, prices were way too high at my local shops in town for just a g of really brown cbd flower or $40 for cart .</p>

<p>My wife and I always wanted to work side by side . So we finally went for it and we got our hemp retail license a few months back in Lockhart, TX. </p>

<p>Our main thing, especially in TX is offer better pricing and help those that canâ€™t get into the medical program for TX. I canâ€™t believe that someone is charging 80+ for a tincture with hardly any thc. Since we sell locally at flea markets, we can be cheaper than retail store. </p>

<p>So far, weâ€™ve been bringing in products weâ€™ve personally used &amp; working with a glass blower from WA. </p>

<p>Hereâ€™s my question. </p>

<p>Are there certain products yâ€™all like using? What pricing would you like to see? And is there certain hemp/cannabinoids youâ€™d like to see more of?</p>
</div><!-- SC_ON -->",,confidence,,,,False,False,False,False,False,,[],[],False,c103b034-bd08-11e9-bcf7-0e473697133a,False,False,False,,[],False,,,,t5_2qho4,False,,,,#373c3f,s0ssz1,True,,Gawdiscool,,36,True,all_ads,False,[],False,,/r/texas/comments/s0ssz1/any_texans_that_use_hempdelta_8_thc/,all_ads,False,https://www.reddit.com/r/texas/comments/s0ssz1/any_texans_that_use_hempdelta_8_thc/,414400,1641844354.0,0,,False,False,{},,,
7,2048,confidence,<praw.reddit.Reddit object at 0x7fbefadafc40>,,texas,,t2_a3lrvb2z,False,,0,False,"Delta-8 legal for now, appeals court holds up Hometown Hero side of injunction","[{'a': ':Texas_House:', 'e': 'emoji', 'u': 'https://emoji.redditmedia.com/61vkpp5p9tt61_t5_2qho4/Texas_House'}, {'e': 'text', 't': ' Politics '}, {'a': ':Texas_Senate:', 'e': 'emoji', 'u': 'https://emoji.redditmedia.com/gdo7xfsl9tt61_t5_2qho4/Texas_Senate'}]",r/texas,False,6,pol,0,93.0,,False,t3_qx4bik,False,light,0.96,,127,0,{},140.0,,False,[],,False,False,,{},:Texas_House: Politics :Texas_Senate:,False,127,,False,False,https://b.thumbs.redditmedia.com/NMYD3_ghpiJQu-zdVtP0yb2eE1Z4upS2j3NrTs2EjUc.jpg,False,,[],{},link,,False,public,1637283447.0,richtext,6,,,text,txcannaco.com,False,,,confidence,,https://txcannaco.com/delta-8-legal-for-now-appeals-court-holds-up-hometown-hero-side-of-injunction/,,False,False,False,False,False,"{'images': [{'source': {'url': 'https://external-preview.redd.it/25dEDDY_AHQYDV-5LdYvD-AP32nlpPvjihq3Kw6H62I.jpg?auto=webp&s=1f3fb9ecc8ed39638928353d026172acf19abff7', 'width': 1600, 'height': 1067}, 'resolutions': [{'url': 'https://external-preview.redd.it/25dEDDY_AHQYDV-5LdYvD-AP32nlpPvjihq3Kw6H62I.jpg?width=108&crop=smart&auto=webp&s=04c2a789c2a77a97d166526d209dfc53b07c9195', 'width': 108, 'height': 72}, {'url': 'https://external-preview.redd.it/25dEDDY_AHQYDV-5LdYvD-AP32nlpPvjihq3Kw6H62I.jpg?width=216&crop=smart&auto=webp&s=44756a332ba359e82839c4afbad6403aae21b2eb', 'width': 216, 'height': 144}, {'url': 'https://external-preview.redd.it/25dEDDY_AHQYDV-5LdYvD-AP32nlpPvjihq3Kw6H62I.jpg?width=320&crop=smart&auto=webp&s=16700783c8a1165f3ab2dad86980e3d3a45b4a66', 'width': 320, 'height': 213}, {'url': 'https://external-preview.redd.it/25dEDDY_AHQYDV-5LdYvD-AP32nlpPvjihq3Kw6H62I.jpg?width=640&crop=smart&auto=webp&s=1c773fa2ea896c686e68b58cb4796bce6056b603', 'width': 640, 'height': 426}, {'url': 'https://external-preview.redd.it/25dEDDY_AHQYDV-5LdYvD-AP32nlpPvjihq3Kw6H62I.jpg?width=960&crop=smart&auto=webp&s=052e537c754764aaeeefdb941027055fb1473bf9', 'width': 960, 'height': 640}, {'url': 'https://external-preview.redd.it/25dEDDY_AHQYDV-5LdYvD-AP32nlpPvjihq3Kw6H62I.jpg?width=1080&crop=smart&auto=webp&s=9248dd3502e7acb986859ba2d80c8ab5f0699234', 'width': 1080, 'height': 720}], 'variants': {}, 'id': 'cCpRZMSs2isP-M9GuCCPsyBBwV9vnXrWFasVixpycDs'}], 'enabled': False}",[],[],False,bcf2e1ba-b375-11e8-b551-0e1da2ccb170,False,False,False,,[],False,,,,t5_2qho4,False,,,,#373c3f,qx4bik,True,,TXCANNACO,,45,True,all_ads,False,[],False,,/r/texas/comments/qx4bik/delta8_legal_for_now_appeals_court_holds_up/,all_ads,False,https://txcannaco.com/delta-8-legal-for-now-appeals-court-holds-up-hometown-hero-side-of-injunction/,414400,1637283447.0,0,,False,False,{},,,
8,2048,confidence,<praw.reddit.Reddit object at 0x7fbefadafc40>,,texas,,t2_3q5hnq8z,False,,0,False,Texas appeals court upholds legality of delta-8 THC â€” again!,"[{'e': 'text', 't': 'News'}]",r/texas,False,6,,0,112.0,,False,t3_qzu3v9,False,light,0.99,,305,1,{},140.0,,False,[],,False,False,,{},News,False,305,,False,False,https://a.thumbs.redditmedia.com/rSLgmaN_AlddAcHlwM8vKMac4Yv-T0msU6QihqUN760.jpg,False,,[],{'gid_1': 1},link,,False,public,1637610780.0,richtext,6,,,text,nothingbuthemp.net,False,,,confidence,,https://www.nothingbuthemp.net/post/texas-appeals-court-upholds-legality-of-delta-8-thc-for-now,,False,False,False,False,False,"{'images': [{'source': {'url': 'https://external-preview.redd.it/1737Teo8dxaev1a25M570F88KY0kLLWgnc-OI-Z_USo.jpg?auto=webp&s=3de4249ecf6641642c9849ab1485f09c007d7939', 'width': 700, 'height': 560}, 'resolutions': [{'url': 'https://external-preview.redd.it/1737Teo8dxaev1a25M570F88KY0kLLWgnc-OI-Z_USo.jpg?width=108&crop=smart&auto=webp&s=f218d6eac83c5f9dfb605e33929b0be06bc1d871', 'width': 108, 'height': 86}, {'url': 'https://external-preview.redd.it/1737Teo8dxaev1a25M570F88KY0kLLWgnc-OI-Z_USo.jpg?width=216&crop=smart&auto=webp&s=77fd5a384609b934e22a1b0519e5eaf27de5c717', 'width': 216, 'height': 172}, {'url': 'https://external-preview.redd.it/1737Teo8dxaev1a25M570F88KY0kLLWgnc-OI-Z_USo.jpg?width=320&crop=smart&auto=webp&s=f23fa89f4799970793d3e96803e338e2d04a561b', 'width': 320, 'height': 256}, {'url': 'https://external-preview.redd.it/1737Teo8dxaev1a25M570F88KY0kLLWgnc-OI-Z_USo.jpg?width=640&crop=smart&auto=webp&s=b93c7eb3fb3fe2a12f31b6ca627b525d40745c10', 'width': 640, 'height': 512}], 'variants': {}, 'id': 'W7Y8XnxXCP1QuDTDaPPBsegsqDLKWGZEVKEJ24Obo8A'}], 'enabled': False}","[{'giver_coin_reward': None, 'subreddit_id': None, 'is_new': False, 'days_of_drip_extension': 0, 'coin_price': 100, 'id': 'gid_1', 'penny_donate': None, 'award_sub_type': 'GLOBAL', 'coin_reward': 0, 'icon_url': 'https://www.redditstatic.com/gold/awards/icon/silver_512.png', 'days_of_premium': 0, 'tiers_by_required_awardings': None, 'resized_icons': [{'url': 'https://www.redditstatic.com/gold/awards/icon/silver_16.png', 'width': 16, 'height': 16}, {'url': 'https://www.redditstatic.com/gold/awards/icon/silver_32.png', 'width': 32, 'height': 32}, {'url': 'https://www.redditstatic.com/gold/awards/icon/silver_48.png', 'width': 48, 'height': 48}, {'url': 'https://www.redditstatic.com/gold/awards/icon/silver_64.png', 'width': 64, 'height': 64}, {'url': 'https://www.redditstatic.com/gold/awards/icon/silver_128.png', 'width': 128, 'height': 128}], 'icon_width': 512, 'static_icon_width': 512, 'start_date': None, 'is_enabled': True, 'awardings_required_to_grant_benefits': None, 'description': ""Shows the Silver Award... and that's it."", 'end_date': None, 'subreddit_coin_reward': 0, 'count': 1, 'static_icon_height': 512, 'name': 'Silver', 'resized_static_icons': [{'url': 'https://www.redditstatic.com/gold/awards/icon/silver_16.png', 'width': 16, 'height': 16}, {'url': 'https://www.redditstatic.com/gold/awards/icon/silver_32.png', 'width': 32, 'height': 32}, {'url': 'https://www.redditstatic.com/gold/awards/icon/silver_48.png', 'width': 48, 'height': 48}, {'url': 'https://www.redditstatic.com/gold/awards/icon/silver_64.png', 'width': 64, 'height': 64}, {'url': 'https://www.redditstatic.com/gold/awards/icon/silver_128.png', 'width': 128, 'height': 128}], 'icon_format': None, 'icon_height': 512, 'penny_price': None, 'award_type': 'global', 'static_icon_url': 'https://www.redditstatic.com/gold/awards/icon/silver_512.png'}]",[],False,dd1d9f22-d066-11e7-a592-0e9f2c9b3e5c,False,False,False,,[],False,,,,t5_2qho4,False,,,,#373c3f,qzu3v9,True,,MedicalAd7014,,11,True,all_ads,False,[],False,,/r/texas/comments/qzu3v9/texas_appeals_court_upholds_legality_of_delta8/,all_ads,False,https://www.nothingbuthemp.net/post/texas-appeals-court-upholds-legality-of-delta-8-thc-for-now,414400,1637610780.0,0,,False,False,{},,,
9,2048,confidence,<praw.reddit.Reddit object at 0x7fbefadafc40>,,texas,,t2_iwi67,False,,0,False,Texas veterans join fight against state's Delta 8 ban,"[{'e': 'text', 't': 'News'}]",r/texas,False,6,,0,93.0,,False,t3_qn4pu8,False,light,0.97,,228,0,{},140.0,,False,[],,False,False,,{},News,False,228,,False,True,https://b.thumbs.redditmedia.com/ebBQcyjufHBnDU5bdUvDtpTjxVtD5QxtO-9UTBax1fc.jpg,False,,[],{},link,,False,public,1636092473.0,richtext,6,,,text,chron.com,False,,,confidence,,https://www.chron.com/news/houston-texas/article/delta-8-ban-lawsuit-hearing-veterans-16593142.php,,False,False,False,False,False,"{'images': [{'source': {'url': 'https://external-preview.redd.it/CfTrv_uVY_nXEL1MN3NGJFZTbxol1nizRrP-0OseKlo.jpg?auto=webp&s=97c756dde241c39b7f4aecf040a75f9b95a44b65', 'width': 1800, 'height': 1200}, 'resolutions': [{'url': 'https://external-preview.redd.it/CfTrv_uVY_nXEL1MN3NGJFZTbxol1nizRrP-0OseKlo.jpg?width=108&crop=smart&auto=webp&s=7190ed4426a26defc007295e0d8bea7650fd3df4', 'width': 108, 'height': 72}, {'url': 'https://external-preview.redd.it/CfTrv_uVY_nXEL1MN3NGJFZTbxol1nizRrP-0OseKlo.jpg?width=216&crop=smart&auto=webp&s=8cc21a0b5db101251bfb3988664cf9a88d03799f', 'width': 216, 'height': 144}, {'url': 'https://external-preview.redd.it/CfTrv_uVY_nXEL1MN3NGJFZTbxol1nizRrP-0OseKlo.jpg?width=320&crop=smart&auto=webp&s=6c8b04c69bba699ab7637a2a15365d0235bf9893', 'width': 320, 'height': 213}, {'url': 'https://external-preview.redd.it/CfTrv_uVY_nXEL1MN3NGJFZTbxol1nizRrP-0OseKlo.jpg?width=640&crop=smart&auto=webp&s=9c2f36638a815350442120d188420caeaa02995e', 'width': 640, 'height': 426}, {'url': 'https://external-preview.redd.it/CfTrv_uVY_nXEL1MN3NGJFZTbxol1nizRrP-0OseKlo.jpg?width=960&crop=smart&auto=webp&s=10b920d6ab4698250195b8340fe32d11f2778cc9', 'width': 960, 'height': 640}, {'url': 'https://external-preview.redd.it/CfTrv_uVY_nXEL1MN3NGJFZTbxol1nizRrP-0OseKlo.jpg?width=1080&crop=smart&auto=webp&s=6c9a161b7da3f624bad34b204066e2babcc7c5f7', 'width': 1080, 'height': 720}], 'variants': {}, 'id': 'XkfHvq0A4E-t9wTA_GwlW4jGVb0UrFHFU_n-2Uk-y1o'}], 'enabled': False}",[],[],False,dd1d9f22-d066-11e7-a592-0e9f2c9b3e5c,False,False,False,,[],False,,,,t5_2qho4,False,,,,#373c3f,qn4pu8,True,,Philo1927,,39,True,all_ads,False,[],False,,/r/texas/comments/qn4pu8/texas_veterans_join_fight_against_states_delta_8/,all_ads,False,https://www.chron.com/news/houston-texas/article/delta-8-ban-lawsuit-hearing-veterans-16593142.php,414400,1636092473.0,0,,False,False,{},,,
10,2048,confidence,<praw.reddit.Reddit object at 0x7fbefadafc40>,,texas,,t2_bhrep4op,False,,0,False,Cannabis Shop Owner Says He May Have To Move His Business From Texas If Delta 8 Is Illegal,"[{'e': 'text', 't': 'News'}]",r/texas,False,6,,0,78.0,,False,t3_qscngo,False,light,0.91,,112,0,{},140.0,,False,[],,False,False,,{},News,False,112,,False,False,https://b.thumbs.redditmedia.com/nPVcxIzHoZN6cc7EDLFxs3tFZHcJLogWivkByqWQ4_k.jpg,False,,[],{},link,,False,public,1636728229.0,richtext,6,,,text,mypoint.tv,False,,,confidence,,https://mypoint.tv/news/cannabis-shop-owner-says-he-may-have-to-move-his-business-out-of-the-state-if-delta-8-is-illegal--hqB2-P4UQaOlBG8nclw66g?utm_source=reddit&utm_medium=social&utm_campaign=delta8injunction,,False,False,False,False,False,"{'images': [{'source': {'url': 'https://external-preview.redd.it/7jSHfTCt6Wgph3XA3FFfx2WHWZzs0pEq_yPXdMDL4wI.jpg?auto=webp&s=d883754d359fcfd7147703d7e5da325a55782486', 'width': 3840, 'height': 2160}, 'resolutions': [{'url': 'https://external-preview.redd.it/7jSHfTCt6Wgph3XA3FFfx2WHWZzs0pEq_yPXdMDL4wI.jpg?width=108&crop=smart&auto=webp&s=bd97252a5a373d3f3b36febfe4e768d2ec131702', 'width': 108, 'height': 60}, {'url': 'https://external-preview.redd.it/7jSHfTCt6Wgph3XA3FFfx2WHWZzs0pEq_yPXdMDL4wI.jpg?width=216&crop=smart&auto=webp&s=e97e5c7c1968523b02ea4f2a223d5b83de3c7037', 'width': 216, 'height': 121}, {'url': 'https://external-preview.redd.it/7jSHfTCt6Wgph3XA3FFfx2WHWZzs0pEq_yPXdMDL4wI.jpg?width=320&crop=smart&auto=webp&s=b42a21f4f2f07c42cac5020df3842ade4a646b41', 'width': 320, 'height': 180}, {'url': 'https://external-preview.redd.it/7jSHfTCt6Wgph3XA3FFfx2WHWZzs0pEq_yPXdMDL4wI.jpg?width=640&crop=smart&auto=webp&s=de7279c396d2bbf5a63b591b86fe1057abd24879', 'width': 640, 'height': 360}, {'url': 'https://external-preview.redd.it/7jSHfTCt6Wgph3XA3FFfx2WHWZzs0pEq_yPXdMDL4wI.jpg?width=960&crop=smart&auto=webp&s=a669349d259531382273856a27eab430e310e06e', 'width': 960, 'height': 540}, {'url': 'https://external-preview.redd.it/7jSHfTCt6Wgph3XA3FFfx2WHWZzs0pEq_yPXdMDL4wI.jpg?width=1080&crop=smart&auto=webp&s=41622fbf2e374247ddaebd55bcb03c9cfda84662', 'width': 1080, 'height': 607}], 'variants': {}, 'id': 'sGJDcDYj2sWAEd0FgorNXs8xb0E4cLi3QvgrUGq8s6I'}], 'enabled': False}",[],[],False,dd1d9f22-d066-11e7-a592-0e9f2c9b3e5c,False,False,False,,[],False,,,,t5_2qho4,False,,,,#373c3f,qscngo,True,,My_Point_TV,,16,True,all_ads,False,[],False,,/r/texas/comments/qscngo/cannabis_shop_owner_says_he_may_have_to_move_his/,all_ads,False,https://mypoint.tv/news/cannabis-shop-owner-says-he-may-have-to-move-his-business-out-of-the-state-if-delta-8-is-illegal--hqB2-P4UQaOlBG8nclw66g?utm_source=reddit&utm_medium=social&utm_campaign=delta8injunction,414400,1636728229.0,0,,False,False,{},,,
